醫事機構代碼,醫事機構名稱,醫事機構地址,醫事機構電話,成人口罩剩餘數,兒童口罩剩餘數,來源資料時間
5902040050,富翔藥局,高雄市楠梓區常德路３０７號,(07)3516365,198,92,2020/02/29 12:21:38
5902040069,新友藥局,高雄市楠梓區萬昌路１１１號,(07)3653534,0,156,2020/02/29 12:21:38
5902040087,世詠藥局,高雄市楠梓區楠都東街１３８號,(07)3539869,511,966,2020/02/29 12:21:38
5902040096,宗隆藥局,高雄市楠梓區右昌街２２０號,(07)3622203,378,1360,2020/02/29 12:21:38
5902040112,丁丁楠梓藥局,高雄市楠梓區建楠路１３０、１３２、１３４號,(07)3533743,230,374,2020/02/29 12:21:38
5902040158,黃藥局,高雄市楠梓區惠楠里建楠路１８６號,(07)3515700,0,136,2020/02/29 12:21:38
5902040185,東初藥局,高雄市楠梓區楠梓路３２號,(07)3511261,0,408,2020/02/29 12:21:38
5902040210,益民藥局,高雄市楠梓區建楠路４７號,(07)3522161,14,776,2020/02/29 12:21:38
5902040229,進昇藥局,高雄市楠梓區德賢路２０２號,(07)3652334,0,700,2020/02/29 12:21:38
5902040238,筆秀藥局,高雄市楠梓區青埔街１５２號,(07)3622412,68,480,2020/02/29 12:21:38
5902040274,千惠藥局,高雄市楠梓區和光街１８１號,(07)3631268,654,1154,2020/02/29 12:21:38
5902040498,順明藥局,高雄市楠梓區和光街６５號,(07)3615574,42,1508,2020/02/29 12:21:38
5902040532,聯亞藥局,高雄市揇梓區軍校路７１０號,(07)3638387,258,1408,2020/02/29 12:21:38
5902041226,正人藥師藥局,高雄市楠梓區和昌里軍校路６７２號,(07)3652942,0,1450,2020/02/29 12:21:38
5902042269,常禾藥局,高雄市楠梓區常德路３３３號一樓,(07)3537431,0,825,2020/02/29 12:21:38
5902042376,佶辰藥局,高雄市楠梓區德民路６４１號１Ｆ,(07)3662802,18,846,2020/02/29 12:21:38
5902042447,建佑藥局,高雄市楠梓區右昌街１９１號,(07)3626893,10,214,2020/02/29 12:21:38
5902042474,誠群藥局,高雄市楠梓區樂群路１８２號１樓,(07)3661733,10,352,2020/02/29 12:21:38
5902042492,合德中西藥師藥局,高雄市楠梓區楠梓路４８６號,(07)3581291,444,607,2020/02/29 12:21:38
5902042563,天健藥局,高雄市楠梓區後昌路１０８７號,(07)3634179,186,1082,2020/02/29 12:21:38
5902042590,德賢藥師藥局,高雄市楠梓區德賢路５５１號,(07)3606056,262,788,2020/02/29 12:21:38
5902042657,皇慶藥局,高雄市楠梓區和光街１９１號,(07)3643352,0,808,2020/02/29 12:21:38
5902042661,元春中西藥師藥局,高雄市楠梓區後昌路８３７巷３７號,(07)3605656,220,116,2020/02/29 12:21:38
5902042714,長義藥局,高雄市楠梓區惠民路４８號,(07)3640593,0,686,2020/02/29 12:21:38
5902042769,家安藥局,高雄市楠梓區後昌新路１３號１樓,(07)3600066,2,669,2020/02/29 12:21:38
5902050092,明曜藥局,高雄市三民區澄和路９６號,(07)3803807,22,1106,2020/02/29 12:21:38
5902050154,杏安藥局,高雄市三民區十全一路91 號,(07)3111606,688,1622,2020/02/29 12:21:38
5902050298,瑞鶴藥局,高雄市三民區寶德里義德路２５號,(07)3862757,238,916,2020/02/29 12:21:38
5902050323,信彰藥師藥局,高雄市三民區鼎中路６２７號,(07)3422376,110,606,2020/02/29 12:21:38
5902050350,日星藥局,高雄市三民區寶龍里惠德街３８號,(07)3845188,1158,1804,2020/02/29 12:21:38
5902050378,安成藥局,高雄市三民區察哈爾二街６３號,(07)3229295,74,952,2020/02/29 12:21:38
5902050387,合祥藥局,高雄市三民區本元里昭良街６８號,(07)3830180,1048,1748,2020/02/29 12:21:38
5902050412,春仁藥局,高雄市三民區覺民路２２５號,(07)3962341,522,1524,2020/02/29 12:21:38
5902050467,人禾藥局,高雄市三民區達仁里九如二路３２４號,(07)3215681,262,1494,2020/02/29 12:21:38
5902050565,澄和藥局,高雄市三民區澄和路６６號,(07)3923111,1039,1751,2020/02/29 12:21:38
5902050592,建昌藥局,高雄市三民區十全一路１０５號１樓,(07)3232356,612,1626,2020/02/29 12:21:38
5902050636,嘉益藥局,高雄市三民區重慶街３０號,(07)3110157,1592,1854,2020/02/29 12:21:38
5902050681,全信藥局,高雄市三民區鼎中里鼎中路１０６號,(07)3428155,476,1192,2020/02/29 12:21:38
5902050770,仁生藥局,高雄市三民區民享里熱河二街７８號,(07)3118765,30,1324,2020/02/29 12:21:38
5902050798,友泰藥局,高雄市三民區中和街１６９號,(07)3125236,1274,1322,2020/02/29 12:21:38
5902050903,皇安藥局,高雄市三民區九如一路４６１號,(07)3866779,111,866,2020/02/29 12:21:38
5902050912,雅信藥局,高雄市三民區鼎山街３２６號,(07)3830821,388,1427,2020/02/29 12:21:38
5902050958,安信藥局,高雄市三民區灣中里鼎山街６６５號,(07)3825577,746,1452,2020/02/29 12:21:38
5902051222,利民藥局,高雄市三民區孝順街７４號,(07)3125436,279,1522,2020/02/29 12:21:38
5902051240,明皇藥局,高雄市三民區寶國里義華路１８１號,(07)3860121,174,1348,2020/02/29 12:21:38
5902051268,上正藥師藥局,高雄市三民區憲政路２５５號,(07)2223355,0,776,2020/02/29 12:21:38
5902051642,安寧藥局,高雄市三民區嫩江街３９號,(07)3217585,593,1206,2020/02/29 12:21:38
5902051786,億生藥局,高雄市三民區南台路２００號,(07)2873436,410,1652,2020/02/29 12:21:38
5902051866,久大藥局,高雄市三民區本文里立忠路３２號１Ｆ,(07)3858116,664,1410,2020/02/29 12:21:38
5902053833,建銘藥局,高雄市三民區吉林街２６２號,(07)3133460,18,836,2020/02/29 12:21:38
5902054689,善全藥局,高雄市三民區義華路３９１號,(07)3960269,690,1490,2020/02/29 12:21:38
5902054741,文安學藥局,高雄市三民區寶業里覺民路６２號,(07)3809400,0,156,2020/02/29 12:21:38
5902054858,勝發藥局,高雄市三民區金鼎路３５０號,(07)3474780,68,1084,2020/02/29 12:21:38
5902055480,建保藥局,高雄市三民區陽明路４１３號,(07)3920433,0,702,2020/02/29 12:21:38
5902056638,柏仁藥局,高雄市三民區覺民路５０４號,(07)3976016,230,1028,2020/02/29 12:21:38
5902056692,大樂藥局,高雄市三民區明誠二路１６號一樓,(07)3501052,1783,1740,2020/02/29 12:21:38
5902056718,岱安藥局,高雄市三民區熱河二街２３號,(07)3219946,1498,1592,2020/02/29 12:21:38
5902056754,大家藥局,高雄市三民區鼎中路２２９號１樓,(07)3107632,1144,1452,2020/02/29 12:21:38
5902056807,長慶藥局,高雄市三民區金鼎路３１０號,(07)3105835,148,762,2020/02/29 12:21:38
5902056825,新正興藥局,高雄市三民區正興路１００號,(07)3892646,525,1574,2020/02/29 12:21:38
5902056923,鴻慶藥局,高雄市三民區裕誠路７０號,(07)9536166,1727,1586,2020/02/29 12:21:38
5902057126,民安藥局,高雄市三民區嫩江街７０號,(07)3121381,110,1533,2020/02/29 12:21:38
5902057144,欣仁惠藥局,高雄市三民區大昌二路２４８號,(07)3837833,418,1050,2020/02/29 12:21:38
5902057162,台安藥局,高雄市三民區華德街１４９號１樓,(07)3972340,1506,1547,2020/02/29 12:21:38
5902057288,育英藥局,高雄市三民區灣子里和順街３９號,(07)3824467,464,1282,2020/02/29 12:21:38
5902057368,崧民藥師藥局,高雄市三民區金鼎路２２８號,(07)3102496,265,1321,2020/02/29 12:21:38
5902057484,永勝藥局,高雄市三民區褒忠街１１４號,(07)3814643,334,1268,2020/02/29 12:21:38
5902057493,上泰藥局,高雄市三民區鼎山街５６９號,(07)3987396,98,1210,2020/02/29 12:21:38
5902057500,陽明藥局,高雄市三民區陽明路２８７號,(07)3960376,44,1086,2020/02/29 12:21:38
5902057519,伍陸藥局,高雄市三民區正興路９４號,(07)3890676,0,1134,2020/02/29 12:21:38
5902057546,華南藥局,高雄市三民區中和街１２４號,(07)3127483,1,995,2020/02/29 12:21:38
5902057680,健爾康藥局,高雄市三民區正興路２３號,(07)3965658,21,760,2020/02/29 12:21:38
5902057733,新久億藥局,高雄市三民區正興路１８３號,(07)3986909,357,1058,2020/02/29 12:21:38
5902057822,建工丁丁藥局,高雄市三民區建工路５６８號,(07)3830841,244,703,2020/02/29 12:21:38
5902057831,愛橋藥局,高雄市三民區陽明路１９２號,(07)3945146,468,1148,2020/02/29 12:21:38
5902057902,利安藥局,高雄市三民區建工路５４５號,(07)3965550,374,1568,2020/02/29 12:21:38
5902057920,必好藥局,高雄市三民區義華路４６０號,(07)3851751,24,292,2020/02/29 12:21:38
5902057939,朝陽健保藥局,高雄市三民區陽明路５７號１樓,(07)3839886,83,842,2020/02/29 12:21:38
5902057948,振源藥局,高雄市三民區熱河一街３５５號１樓,(07)3112541,514,606,2020/02/29 12:21:38
5902060025,連作藥局,高雄市新興區大同一路２０３－１號,(07)2154716,0,763,2020/02/29 12:21:38
5902060132,成益藥局,高雄市新興區德望里復興一路４之２號,(07)2265015,60,1212,2020/02/29 12:21:38
5902060150,永明藥局,高雄市新興區仁智街２２３號,(07)2619832,452,1464,2020/02/29 12:21:38
5902061540,長青藥局,高雄市新興區六合路１１４號,(07)2229220,32,1165,2020/02/29 12:21:38
5902061577,銘泰藥局,高雄市新興區自立二路１６６號,(07)2855165,136,792,2020/02/29 12:21:38
5902061899,元盛藥局,高雄市新興區六合路１５３號,(07)2228183,6,666,2020/02/29 12:21:38
5902071528,岩生藥局,高雄市前金區自立一路１５－１號,(07)2863608,222,1361,2020/02/29 12:21:38
5902071537,大衛藥局,高雄市前金區中華三路１８８號,(07)2859958,0,1232,2020/02/29 12:21:38
5902071546,中華藥局,高雄市前金區中華四路３６３號,(07)2712779,0,1126,2020/02/29 12:21:38
5902080036,瑞林藥局,高雄市苓雅區興中一路２８２號,(07)3312146,620,1783,2020/02/29 12:21:38
5902080287,佳鴻中西藥局,高雄市苓雅區文昌路１１號,(07)7497103,484,1212,2020/02/29 12:21:38
5902080312,正和藥局,高雄市苓雅區福建街３６２號,(07)2265377,82,1062,2020/02/29 12:21:38
5902080376,政德藥局,高雄市苓雅區正大里武廟路２９號,(07)7114371,102,1360,2020/02/29 12:21:38
5902080465,廣德泰藥局,高雄市苓雅區苓雅二路７６號,(07)3340769,6,1274,2020/02/29 12:21:38
5902080474,弘宗藥局,高雄市苓雅區武智街２號,(07)7211088,40,1320,2020/02/29 12:21:38
5902080518,福海藥局,高雄市苓雅區武慶三路５８號,(07)7618855,22,746,2020/02/29 12:21:38
5902080527,三和藥局,高雄市苓雅區廣州二街１１７號,(07)7220808,256,1196,2020/02/29 12:21:38
5902080545,柏松藥局,高雄市苓雅區輔仁路１７５號,(07)7119786,1,683,2020/02/29 12:21:38
5902080616,一加藥局,高雄市苓雅區和平一路四二號,(07)7212748,142,1324,2020/02/29 12:21:38
5902080741,天新藥局,高雄市苓雅區華堂里林森二路１－３號,(07)3342754,122,1340,2020/02/29 12:21:38
5902080803,功安中西大藥局,高雄市苓雅區三多二路２９１號,(07)7215949,72,1656,2020/02/29 12:21:38
5902080858,福興藥局,高雄市苓雅區成功一路５２號,(07)3331862,944,1676,2020/02/29 12:21:38
5902081015,明群藥局,高雄市苓雅區英明路５４號,(07)7254953,0,1070,2020/02/29 12:21:38
5902081186,寶麒藥局,高雄市苓雅區三多一路１４４號,(07)7610355,486,1438,2020/02/29 12:21:38
5902081328,東信藥局,高雄市苓雅區三多一路１８９號,(07)7613309,149,1433,2020/02/29 12:21:38
5902083457,順一藥局,高雄市苓雅區田西里成功一路２１０號,(07)3330011,6,1180,2020/02/29 12:21:38
5902083582,健智藥局,高雄市苓雅區四維二路９６之２號,(07)7249153,3,647,2020/02/29 12:21:38
5902083591,晨安藥局,高雄市苓雅區興中一路１６０號,(07)3365463,186,1478,2020/02/29 12:21:38
5902084703,瑞生藥局,高雄市苓雅區自強三路３１號,(07)3305239,108,838,2020/02/29 12:21:38
5902084749,琉璃光藥師藥局,高雄市苓雅區四維一路２９２號之一樓,(07)7160930,862,1702,2020/02/29 12:21:38
5902084776,杏合藥局,高雄市苓雅區福德二路２１６號,(07)7268966,765,1585,2020/02/29 12:21:38
5902084785,新良安藥局,高雄市苓雅區苓雅二路１０６號,(07)3386980,0,752,2020/02/29 12:21:38
5902084801,邱吉祥藥局,高雄市苓雅區凱旋二路１３５號,(07)2226055,392,1544,2020/02/29 12:21:38
5902085031,上好藥局,高雄市苓雅區四維一路六三號一樓,(07)7266863,288,1314,2020/02/29 12:21:38
5902085139,健福藥局,高雄市苓雅區永富街１０號,(07)3381746,0,1196,2020/02/29 12:21:38
5902085148,召祐健保藥局,高雄市苓雅區正義路９３號,(07)7493719,629,1430,2020/02/29 12:21:38
5902085166,景福藥局,高雄市苓雅區和平一路１４７之５號,(07)7719152,0,978,2020/02/29 12:21:38
5902085184,惠春藥局,高雄市苓雅區武慶三路９６號,(07)7611358,698,1516,2020/02/29 12:21:38
5902085228,永森藥局,高雄市苓雅區建國一路２９０號,(07)7163087,806,1884,2020/02/29 12:21:38
5902085308,幸福藥師藥局,高雄市苓雅區青年一路１６７－３號,(07)5368701,14,574,2020/02/29 12:21:38
5902085344,意祥藥局,高雄市苓雅區武廟路１４２之１號,(07)7224835,536,1424,2020/02/29 12:21:38
5902085371,加和藥局,高雄市苓雅區和平一路１４３之７號,(07)7219332,377,1251,2020/02/29 12:21:38
5902090032,全國大藥局,高雄市前鎮區三多二路４０３號１樓,(07)3345775,548,1516,2020/02/29 12:21:38
5902090087,久億藥局,高雄市前鎮區保泰路３５１號,(07)7619333,0,834,2020/02/29 12:21:38
5902090103,文仁藥局,高雄市前鎮區明正里草衙二路４６０號,(07)8413116,0,2,2020/02/29 12:21:38
5902090121,意文藥局,高雄市前鎮區瑞華里武營路１８３號,(07)7226570,0,876,2020/02/29 12:21:38
5902090167,勝惠藥局,高雄市前鎮區忠孝里三多三路７１號,(07)3354766,698,1786,2020/02/29 12:21:38
5902090363,八仙藥局,高雄市前鎮區瑞隆路２５１號,(07)7270001,916,1374,2020/02/29 12:21:38
5902090765,家安大藥局,高雄市前鎮區崗山南街３４２巷２１號,(07)7137711,0,1444,2020/02/29 12:21:38
5902090827,博平藥局,高雄市前鎮區草衙二路３７７號,(07)8311814,0,352,2020/02/29 12:21:38
5902090970,民光藥局,高雄市前鎮區林森三路４８號,(07)3335362,167,1170,2020/02/29 12:21:38
5902091128,北京藥局,高雄市前鎮區公正路３１號,(07)7113100,269,280,2020/02/29 12:21:38
5902092205,百宏中西大藥局,高雄市前鎮區復興三路１９４號,(07)3386719,64,634,2020/02/29 12:21:38
5902092296,迎廣藥局,高雄市前鎮區林森三路１５０號２樓,(07)3321466,942,1684,2020/02/29 12:21:38
5902092321,彥芳藥局,高雄市前鎮區長江街６５號１樓,(07)3302007,146,742,2020/02/29 12:21:38
5902092358,惠芳藥局,高雄市前鎮區一心一路４８６號,(07)5370650,286,409,2020/02/29 12:21:38
5902092410,旺盛藥局,高雄市前鎮區永豐路１０８號,(07)7512899,54,1300,2020/02/29 12:21:38
5902092492,元生藥局,高雄市前鎮區鎮興路２２６號１樓,(07)8156356,0,996,2020/02/29 12:21:38
5902092554,協和藥局,高雄市前鎮區中華五路９８３號,(07)5377769,46,1091,2020/02/29 12:21:38
5902092572,羿昇藥局,高雄市前鎮區一心一路４９２號,(07)3387737,1004,1670,2020/02/29 12:21:38
5902092643,晏昇藥局,高雄市前鎮區凱旋三路８１號,(07)7235136,0,1000,2020/02/29 12:21:38
5902092787,吉昌藥局,高雄市前鎮區正勤路１００號,(07)3368782,1510,1376,2020/02/29 12:21:38
5902092887,民權丁丁藥局,高雄市前鎮區民權二路３４５號,(07)9650177,0,242,2020/02/29 12:21:38
5902092896,廣泰藥局,高雄市前鎮區瑞北路５６號,(07)7162166,0,376,2020/02/29 12:21:38
5902092910,健家藥局,高雄市前鎮區二聖二路４５號,(07)3389986,633,1368,2020/02/29 12:21:38
5902092956,慈濟健保藥局,高雄市前鎮區鎮州路２１１號,(07)8159788,0,1363,2020/02/29 12:21:38
5902100033,旗后藥局,高雄市旗津區中洲三路７１５號,(07)5715838,490,1560,2020/02/29 12:21:38
5902100042,千佑藥局,高雄市旗津區復興里中洲三路５１３號,(07)5712619,2,1076,2020/02/29 12:21:38
5902101094,康富藥局,高雄市旗津區旗津二路２２０號,(07)5710567,36,112,2020/02/29 12:21:38
5902110066,文祺藥局,高雄市小港區正苓里平治街１１２號,(07)8014066,0,576,2020/02/29 12:21:38
5902110093,鳳明中西大藥局,高雄市小港區二苓路２４７號,(07)8011846,114,264,2020/02/29 12:21:38
5902110244,億大藥局,高雄市小港區三苓里永義街１７１號,(07)8014958,0,938,2020/02/29 12:21:38
5902110299,大裕藥局,高雄市小港區小港里小港路２６１號,(07)8211467,2,194,2020/02/29 12:21:38
5902110422,臨生藥局,高雄市小港區鳳鳴路１４６－４號,(07)8711290,0,1124,2020/02/29 12:21:38
5902110431,龍祺藥局,高雄市小港區平和路１１１號,(07)8315352,70,1392,2020/02/29 12:21:38
5902110593,慈林藥局,高雄市小港區鳳林路９３號,(07)8718087,0,1032,2020/02/29 12:21:38
5902110600,高泰藥局,高雄市小港區桂陽路７號,(07)7930043,0,74,2020/02/29 12:21:38
5902110628,悅是康藥局,高雄市小港區漢民路２７６號,(07)8010012,152,608,2020/02/29 12:21:38
5902111661,康乃爾藥局,高雄市小港區漢民路４１３號２樓,(07)8026291,190,472,2020/02/29 12:21:38
5902111670,桂林活力藥師藥局,高雄市小港區桂陽路４０號,(07)7931248,258,128,2020/02/29 12:21:38
5902111698,康莊藥局,高雄市小港區康莊路６９號一樓,(07)8063384,162,1114,2020/02/29 12:21:38
5902111796,力安藥師藥局,高雄市小港區桂陽路316號１樓,(07)7918167,14,202,2020/02/29 12:21:38
5903010010,康健藥局,臺中市豐原區西勢里中山路３７３號,(04)25279542,54,928,2020/02/29 12:21:38
5903010038,金宏健保藥局,臺中市豐原區安康路１０３號,(04)25288262,0,222,2020/02/29 12:21:38
5903010056,一加藥局,臺中市豐原區中正路１９５號,(04)25237700,332,1062,2020/02/29 12:21:38
5903010118,理妍藥局,臺中市豐原區中正路３７９號,(04)25270140,368,1122,2020/02/29 12:21:38
5903010127,友誠藥局,臺中市豐原區豐東路４０１號１樓,(04)25132371,0,242,2020/02/29 12:21:38
5903010145,維立藥局,臺中市豐原區豐南街１２號１樓,(04)25337605,0,104,2020/02/29 12:21:38
5903010181,永豐藥局,臺中市豐原區中山路４２２號１樓,(04)25280088,0,823,2020/02/29 12:21:38
5903010261,豐原西勢藥局,臺中市豐原區西勢路２００號１樓,(04)25262330,0,236,2020/02/29 12:21:38
5903010270,福心藥局,臺中市豐原區中正路７１５號１樓,(04)25229292,146,487,2020/02/29 12:21:38
5903010289,心美日藥局,臺中市豐原區中山路３５９號１樓,(04)25260703,0,108,2020/02/29 12:21:38
5903010305,大樹圓環藥局,臺中市豐原區圓環東路６１７號１樓,(04)25122212,200,50,2020/02/29 12:21:38
5903010314,豐原百宏中西藥局,臺中市豐原區水源路５９５號１樓,(04)25242185,204,428,2020/02/29 12:21:38
5903010332,富田藥局,臺中市豐原區文昌街１５２號１樓,(04)25225453,0,322,2020/02/29 12:21:38
5903010341,昭仁藥局,臺中市豐原區南陽路１４０號,(04)25243559,0,96,2020/02/29 12:21:38
5903010350,甲蒂健保藥局,臺中市豐原區豐東路３０８號,(04)25256028,98,40,2020/02/29 12:21:38
5903010378,豐原啄木鳥藥局,臺中市豐原區中山路１７８號１樓,(04)25295340,0,238,2020/02/29 12:21:38
5903010387,信宜藥局,臺中市豐原區中山路３９５號,(04)25229912,966,1362,2020/02/29 12:21:38
5903010403,品安藥局,臺中市豐原區中山路４０５號,(04)25270138,588,1080,2020/02/29 12:21:38
5903010412,佑全豐原圓環東藥局,臺中市豐原區圓環東路５４８、５５０、５５２、５５４號,(04)25246069,0,80,2020/02/29 12:21:38
5903010421,長庚健保大藥局,臺中市豐原區中正路１３２號１樓,(04)25151867,0,764,2020/02/29 12:21:38
5903010430,喜樂魚藥局,臺中市豐原區圓環東路６１３號１樓,(04)25200226,134,846,2020/02/29 12:21:38
5903010449,豐原藥局,臺中市豐原區新生北路２０６號之１（１樓）,(04)25260119,0,1234,2020/02/29 12:21:38
5903010458,心之藥局,臺中市豐原區中山路５０４號,(04)25254959,0,738,2020/02/29 12:21:38
5903010467,阜康藥局,臺中市豐原區中山路２９５號１樓,(04)25155977,1118,1684,2020/02/29 12:21:38
5903010485,大樹圓環藥局,臺中市豐原區圓環東路６１７號１樓,(04)25122212,0,704,2020/02/29 12:21:38
5903010494,百宏大藥局,臺中市豐原區中正路８６０號１樓,(04)25131538,184,310,2020/02/29 12:21:38
5903020034,國良豐藥局,臺中市東勢區豐勢路２１號１樓,(04)25885778,502,774,2020/02/29 12:21:38
5903020043,向日葵藥局,臺中市東勢區豐勢路５５７號,(04)25773428,1644,1262,2020/02/29 12:21:38
5903020052,東勢福倫藥局,臺中市東勢區豐勢路４３８號,(04)25876118,16,404,2020/02/29 12:21:38
5903030012,康好藥局,臺中市大甲區三民路１３２－２號,(04)26802149,0,184,2020/02/29 12:21:38
5903030030,大甲健康藥局,臺中市大甲區蔣公路２４２-１號１樓,(04)26805833,0,208,2020/02/29 12:21:38
5903030058,康達藥局,臺中市大甲區蔣公路２６６號１樓,(04)26862001,0,52,2020/02/29 12:21:38
5903030067,甲尚藥局,台中市大甲區順天路１２８號,(04)26760885,0,196,2020/02/29 12:21:38
5903030076,百禾藥局,臺中市大甲區仁愛街５８號,(04)26872538,0,478,2020/02/29 12:21:38
5903030085,廣元藥局,臺中市大甲區順天路１４６號１樓,(04)26872843,0,676,2020/02/29 12:21:38
5903030110,大甲啄木鳥藥局,臺中市大甲區中山路１段９０５號,(04)26804502,10,8,2020/02/29 12:21:38
5903030138,聖佑藥局,臺中市大甲區中山路１段５７６號１樓,(04)26760156,16,68,2020/02/29 12:21:38
5903030147,能德藥局,臺中市大甲區復興路２２之１號,(04)26873549,297,597,2020/02/29 12:21:38
5903030156,盈盈藥局,臺中市大甲區文武路１８號,(04)26804212,24,88,2020/02/29 12:21:38
5903030165,民和藥局,臺中市大甲區德興路６８號,(04)26871212,0,594,2020/02/29 12:21:38
5903030174,慶安藥局,臺中市大甲區文武路１７８之３號,(04)26802933,0,860,2020/02/29 12:21:38
5903030183,志明藥局,臺中市大甲區民生路２１號,(04)26876221,28,140,2020/02/29 12:21:38
5903030192,大甲合和藥局,臺中市大甲區甲后路５段２６９號１樓,(04)26802310,0,100,2020/02/29 12:21:38
5903040036,得康藥局,臺中市清水區高美路１１７號,(04)26260622,0,18,2020/02/29 12:21:38
5903040045,全佑藥局,臺中市清水區新興路２６０號１樓,(04)26220579,0,52,2020/02/29 12:21:38
5903040063,崇文藥師藥局,臺中市清水區和平路４２８之１５號,(04)26561101,0,914,2020/02/29 12:21:38
5903040072,碧綠谷藥局,臺中市清水區中華路５２５號,(04)26281151,0,36,2020/02/29 12:21:38
5903040081,千順藥局,臺中市清水區光復街１１０－２號１樓,(04)26220580,0,340,2020/02/29 12:21:38
5903050050,關心藥局,臺中市沙鹿區光大路２４２號,(04)26625182,148,922,2020/02/29 12:21:38
5903050087,仁暉健保處方藥局,臺中市沙鹿區向上路７段１３０號,(04)26365626,0,124,2020/02/29 12:21:38
5903050096,沙鹿合和健保藥局,臺中市沙鹿區正義路２號,(04)26320590,0,76,2020/02/29 12:21:38
5903050103,北勢進騰藥局,臺中市沙鹿區北勢東路５０９之７號１樓,(04)26330893,0,72,2020/02/29 12:21:38
5903050149,立好藥局,臺中市沙鹿區北勢東路６９３號１樓,(04)26522389,16,352,2020/02/29 12:21:38
5903050176,全國藥局,臺中市沙鹿區臺灣大道７段９９２號,(04)26627097,150,982,2020/02/29 12:21:38
5903050194,樂齊藥局,臺中市沙鹿區北中路８６－１、８６－２號,(04)26338867,170,228,2020/02/29 12:21:38
5903050201,鎮南藥局,臺中市沙鹿區鎮南路２段５２號,(04)26336160,0,48,2020/02/29 12:21:38
5903050210,富康沙鹿藥局,臺中市沙鹿區沙田路１４２號１樓,(04)26633399,394,180,2020/02/29 12:21:38
5903050229,維康藥局,臺中市沙鹿區鎮南路２段４１２號１樓,(04)26524787,752,1336,2020/02/29 12:21:38
5903050238,百岳大藥局,臺中市沙鹿區鎮南路二段７７號１樓,(04)26359825,0,52,2020/02/29 12:21:38
5903060038,梧棲玖裕藥局,臺中市梧棲區中和街８５號,(04)26583909,0,82,2020/02/29 12:21:38
5903060056,瑞恩藥局,臺中市梧棲區港埠路１段８２７巷６號,(04)26576171,0,26,2020/02/29 12:21:38
5903070016,泉興中西大藥局,臺中市后里區甲后路一段５９８號,(04)25583883,325,1003,2020/02/29 12:21:38
5903070025,得安藥局,臺中市后里區四村路７８號,(04)25585333,558,1050,2020/02/29 12:21:38
5903070043,后禮藥局,臺中市后里區甲后路一段１６３號１樓,(04)25582413,3,779,2020/02/29 12:21:38
5903070052,后里宏安藥局,臺中市后里區福音路２８號１樓,(04)25581036,442,1106,2020/02/29 12:21:38
5903070061,豪銘藥局,臺中市后里區公安路６８號,(04)25562991,0,530,2020/02/29 12:21:38
5903070089,后里瑞士藥師藥局,臺中市后里區甲后路二段５７９號,(04)25566999,0,460,2020/02/29 12:21:38
5903070098,祐恩藥局,臺中市后里區甲后路一段４７８號１樓,(04)25587518,380,750,2020/02/29 12:21:38
5903070105,后里藥局,臺中市后里區文明路１３３號１樓,(04)25590119,144,541,2020/02/29 12:21:38
5903070132,內埔瑞士藥師藥局,臺中市后里區中山路３７號１樓,(04)25566959,312,728,2020/02/29 12:21:38
5903070141,甲后藥局,臺中市后里區甲后路一段２５３號１樓,(04)25577378,440,952,2020/02/29 12:21:38
5903080030,捷達藥局,臺中市神岡區大漢街２５號,(04)25225207,1,65,2020/02/29 12:21:38
5903080085,社南藥局,臺中市神岡區民生路２４號１樓,(04)25616114,4,206,2020/02/29 12:21:38
