醫事機構代碼,醫事機構名稱,醫事機構地址,醫事機構電話,成人口罩剩餘數,兒童口罩剩餘數,來源資料時間
5937060060,慶華藥局,彰化縣溪湖鎮光華里二溪路一段１４號,(04)8852441,488,1220,2020/03/04 10:25:11
5937060088,合生大藥局,彰化縣溪湖鎮湖東里員鹿路二段４０６號,(04)8851560,640,1098,2020/03/04 10:25:11
5937060131,西環藥局,彰化縣溪湖鎮太平里太平街１９１號,(04)8810615,1246,1290,2020/03/04 10:25:11
5937061227,永裕藥局,彰化縣溪湖鎮光華里太平街５４號,(04)8817222,1936,1687,2020/03/04 10:25:11
5937061254,雙鷹藥局,彰化縣溪湖鎮光平里彰水路３段３７９號,(04)8826572,1588,1332,2020/03/04 10:25:11
5937061281,佳佳藥局,彰化縣溪湖鎮二溪路１段２８９號,(04)8815523,1054,1537,2020/03/04 10:25:11
5937061352,永林藥局,彰化縣溪湖鎮大竹里平和街１４２號,(04)8826676,610,1402,2020/03/04 10:25:11
5937061370,正合藥局,彰化縣溪湖鎮彰水路３段２０４號,(04)8851685,1296,1598,2020/03/04 10:25:11
5937061398,寶康藥局,彰化縣溪湖鎮彰水路四段１５３號１樓,(04)8613778,1408,1300,2020/03/04 10:25:11
5937061432,康健藥局,彰化縣溪湖鎮光平里彰水路３段３８８號,(04)8822549,486,1142,2020/03/04 10:25:11
5937061469,福展藥局,彰化縣溪湖鎮湖西里西環路２０９號,(04)8859918,1016,1722,2020/03/04 10:25:11
5937061503,大發藥局,彰化縣溪湖鎮大突里大發路８９號,(04)8822180,1190,1274,2020/03/04 10:25:11
5937061530,大同藥局,彰化縣溪湖鎮大竹里西環路３１號,(04)8828159,530,480,2020/03/04 10:25:11
5937061558,好心情藥局,彰化縣溪湖鎮湖東里大溪路二段３５６號１樓,(04)8811259,942,1166,2020/03/04 10:25:11
5937061567,凱侖藥局,彰化縣溪湖鎮西溪里員鹿路２段臨１號,(04)8812278,994,1676,2020/03/04 10:25:11
5937061594,正光藥局溪湖店,彰化縣溪湖鎮大竹里平和街２０２、２０４號,(04)8825138,790,344,2020/03/04 10:25:11
5937061601,樺霖保健藥局,彰化縣溪湖鎮光平里彰水路３段３７６號,(04)8613668,290,556,2020/03/04 10:25:11
5937061610,大昌藥局,彰化縣溪湖鎮光華里太平街２２號,(04)8612122,1078,1276,2020/03/04 10:25:11
5937061638,志成藥局,彰化縣溪湖鎮平和里彰水路３段２４３號,(04)8853528,1192,1828,2020/03/04 10:25:11
5937061647,溪湖藥局,彰化縣溪湖鎮西環路３６５號,(04)8818617,580,450,2020/03/04 10:25:11
5937061656,東環藥局,彰化縣溪湖鎮湖東街８１巷７０－３、７０－４、７０－５號,(04)8820001,1114,1063,2020/03/04 10:25:11
5937061665,安安藥局,彰化縣溪湖鎮彰水路三段３６３號,(04)8850525,642,328,2020/03/04 10:25:11
5937061674,溪湖華恩保健藥局,彰化縣溪湖鎮青雅路３９號,(04)8817575,814,1257,2020/03/04 10:25:11
5937070011,明輝藥局,彰化縣田中鎮東路里新生街８７號,(04)8740433,554,1268,2020/03/04 10:25:11
5937070020,田中中興藥局,彰化縣田中鎮西路里斗中路一段５４號,(04)8742483,1478,1861,2020/03/04 10:25:11
5937070039,井田藥局,彰化縣田中鎮碧峰里中南路二段511號,(04)8740453,604,1352,2020/03/04 10:25:11
5937070057,大嘉藥局,彰化縣田中鎮中州路１段２６８號,(04)8742071,484,1562,2020/03/04 10:25:11
5937070093,朝仁大藥局,彰化縣田中鎮三民里斗中路二段６２０號,(04)8751551,1366,1766,2020/03/04 10:25:11
5937070128,良安藥局,彰化縣田中鎮北路里員集路二段６１４號,(04)8743196,445,1750,2020/03/04 10:25:11
5937070164,安鑠藥局,彰化縣田中鎮中潭里和平路７６０號,(04)8748728,760,1804,2020/03/04 10:25:11
5937070173,世華藥局,彰化縣田中鎮新民里民族街１３號,(04)8752965,842,1510,2020/03/04 10:25:11
5937070191,仁春藥局,彰化縣田中鎮員集路二段４５３、４５５號,(04)8742409,50,427,2020/03/04 10:25:11
5937071296,大眾藥局,彰化縣田中鎮斗中路一段１４２號,(04)8749723,957,1569,2020/03/04 10:25:11
5937071330,祥品藥局,彰化縣田中鎮北路里福安路３０８號,(04)8762311,448,1196,2020/03/04 10:25:11
5937071358,景平藥局,彰化縣田中鎮西路里中州路１段２７６號,(04)8760468,1536,1822,2020/03/04 10:25:11
5937071385,正益藥局,彰化縣田中鎮北路里新福路５３巷１３號１樓,(04)8761001,1460,1320,2020/03/04 10:25:11
5937071401,田中啄木鳥藥局,彰化縣田中鎮南路里員集路２段２６６號,(04)8746468,722,1001,2020/03/04 10:25:11
5937071447,大安藥局,彰化縣田中鎮新福路５７號,(04)8752201,637,1069,2020/03/04 10:25:11
5937071456,萬禾藥局,彰化縣田中鎮員集路３段２７７號,(04)8742242,693,1373,2020/03/04 10:25:11
5937080115,鎮安藥局,彰化縣二林鎮東和里中山路５２號之２,(04)8960473,498,1382,2020/03/04 10:25:11
5937080160,慈生藥局,彰化縣二林鎮萬興里二溪路六段４５２號,(04)8682287,282,1067,2020/03/04 10:25:11
5937080179,台明藥局,彰化縣二林鎮東和里斗苑路五段２１３號,(04)8966176,1266,2053,2020/03/04 10:25:11
5937080188,信裕藥局,彰化縣二林鎮南光里南安路４３５號,(04)8963684,1534,1504,2020/03/04 10:25:11
5937080277,嘉信藥局,彰化縣二林鎮中山路１４０號,(04)8954029,554,1688,2020/03/04 10:25:11
5937081363,小博士藥局,彰化縣二林鎮斗苑路四段７００號,(04)8957775,1574,1296,2020/03/04 10:25:11
5937081381,美美藥局,彰化縣二林鎮儒林路２段３０８號１樓,(04)8958789,918,1170,2020/03/04 10:25:11
5937081390,永全藥局,彰化縣二林鎮二溪路一段１８號,(04)8958878,1244,1321,2020/03/04 10:25:11
5937081407,長頸鹿藥局,彰化縣二林鎮大成路１段１３７號,(04)8952453,1402,204,2020/03/04 10:25:11
5937081434,二林福倫藥局,彰化縣二林鎮豐田里斗苑路４段６６９、６７１號,(04)8956818,608,1410,2020/03/04 10:25:11
5937081461,育民健保藥局,彰化縣二林鎮東和里新生路７２號,(04)8953956,369,1590,2020/03/04 10:25:11
5937081470,尚禾藥局,彰化縣二林鎮西平里中山路２３０號,(04)8963810,764,1528,2020/03/04 10:25:11
5937081489,二林順順藥局,彰化縣二林鎮仁愛路４５１號,(04)8951351,368,867,2020/03/04 10:25:11
5937081498,新杏林藥局,彰化縣二林鎮東和里斗苑路５段２６０號,(04)8953863,720,1677,2020/03/04 10:25:11
5937081514,加佳藥局,彰化縣二林鎮東和里仁愛路６７８號１樓,(04)8963080,1122,756,2020/03/04 10:25:11
5937081541,康好藥局二林店,彰化縣二林鎮南光里大成路一段５６１號,(04)8966015,984,1238,2020/03/04 10:25:11
5937081569,二林藥局,彰化縣二林鎮斗苑路５段３９號,(04)8950010,592,1152,2020/03/04 10:25:11
5937081578,二林貓頭鷹藥局,彰化縣二林鎮中正路２４、２６號,(04)8952299,798,1132,2020/03/04 10:25:11
5937091056,線西藥局,彰化縣線西鄉寓埔村中央路二段４８號,(04)7582482,108,936,2020/03/04 10:25:11
5937091065,寓埔藥局,彰化縣線西鄉寓埔村中華路４８號１樓,(04)7589805,378,714,2020/03/04 10:25:11
5937101146,伸港藥局,彰化縣伸港鄉新港村信義路１３５號,(04)7992663,74,204,2020/03/04 10:25:11
5937101164,伸港永合藥局,彰化縣伸港鄉新港村新港路２４４號１樓,(04)7988865,363,712,2020/03/04 10:25:11
5937101173,貓頭鷹藥局,彰化縣伸港鄉新港村中山東路９９號,(04)7996596,282,392,2020/03/04 10:25:11
5937101217,友誼藥局,彰化縣伸港鄉新港村中山路１５號,(047)980591,442,620,2020/03/04 10:25:11
5937101226,伸和藥局,彰化縣伸港鄉新港村中正路２０巷２號,(04)7998129,42,909,2020/03/04 10:25:11
5937101235,協和藥局,彰化縣伸港鄉中山路１０１號,(04)7981233,36,168,2020/03/04 10:25:11
5937111062,福興永安藥局,彰化縣福興鄉沿海路４段７３７號,(04)7745268,160,196,2020/03/04 10:25:11
5937111151,健安藥局,彰化縣福興鄉廈粘村沿海路３段２１４－１號１樓,(04)7707835,72,712,2020/03/04 10:25:11
5937111160,東泰藥局,彰化縣福興鄉福興村沿海路５段３６６號,(04)7772277,156,964,2020/03/04 10:25:11
5937111188,好鄰居藥局,彰化縣福興鄉沿海路三段２７３號,(04)7707887,478,812,2020/03/04 10:25:11
5937120025,慶泰藥局,彰化縣秀水鄉安東村中山路１６６號,(04)7698510,172,2120,2020/03/04 10:25:11
5937120043,啟仁藥局,彰化縣秀水鄉安東村文化街１５巷２號,(04)7694953,601,1302,2020/03/04 10:25:11
5937120052,效生藥局,彰化縣秀水鄉民生街９０８號,(04)7683931,196,478,2020/03/04 10:25:11
5937120061,秀水藥局,彰化縣秀水鄉福安村彰水路２段５４１號,(04)7690140,514,940,2020/03/04 10:25:11
5937121184,伸豐藥局,彰化縣秀水鄉福安村彰水路二段６６３號,(04)7697482,172,248,2020/03/04 10:25:11
5937121228,欣冠藥局,彰化縣秀水鄉中山路３４５號,(04)7689699,229,1020,2020/03/04 10:25:11
5937121237,福慧藥局,彰化縣秀水鄉彰水路２段２０３號,(04)7689180,1058,1583,2020/03/04 10:25:11
5937121246,健全藥局,彰化縣秀水鄉安東村中山路２８２－１號,(04)7686649,222,180,2020/03/04 10:25:11
5937121273,秀水福倫藥局,彰化縣秀水鄉彰水路２段５７０號１樓,(04)7699618,130,164,2020/03/04 10:25:11
5937121282,福安藥局,彰化縣秀水鄉彰水路２段５２３號,(04)7686981,760,1626,2020/03/04 10:25:11
5937130049,明志藥局,彰化縣花壇鄉三春村彰員路１段５４２號,(04)7867702,208,570,2020/03/04 10:25:11
5937130058,華榮藥局,彰化縣花壇鄉花壇村花壇街２１９號,(04)7862173,208,376,2020/03/04 10:25:11
5937131153,武田藥局,彰化縣花壇鄉長沙村中正路１２０號,(04)7878683,392,806,2020/03/04 10:25:11
5937131171,祥安藥局,彰化縣花壇鄉彰員路３段８９號,(04)7863460,304,1092,2020/03/04 10:25:11
5937131180,春天藥局,彰化縣花壇鄉中山路２段３０號,(04)7874458,809,1315,2020/03/04 10:25:11
5937131206,花壇福倫藥局,彰化縣花壇鄉中山路２段１５９號１樓,(04)7882818,170,929,2020/03/04 10:25:11
5937131224,恆安藥局,彰化縣花壇鄉花壇村花壇街２４９號１樓,(04)7863990,1275,1694,2020/03/04 10:25:11
5937131233,春生藥局花壇店,彰化縣花壇鄉花壇村中正路５７－１號,(04)7867715,416,271,2020/03/04 10:25:11
5937131242,善生藥局,彰化縣花壇鄉中正路２００號,(04)7862361,260,704,2020/03/04 10:25:11
5937131260,大福藥局,彰化縣花壇鄉長沙村中正路９１號１樓,(04)7880073,1381,1529,2020/03/04 10:25:11
5937131279,仁寶藥局,彰化縣花壇鄉長沙村忠孝街１００－２號,(04)7878555,542,1844,2020/03/04 10:25:11
5937131288,口庄藥局,彰化縣花壇鄉中山路２段５６２號,(04)7867209,912,1307,2020/03/04 10:25:11
5937140018,民生藥局,彰化縣芬園鄉社口村彰南路４段１１３號,(049)2522595,325,1437,2020/03/04 10:25:11
5937140027,金宏恩藥局,彰化縣芬園鄉社口村彰南路４段１０８巷１２號,(049)2522391,576,1610,2020/03/04 10:25:11
5937140045,新得大藥局,彰化縣芬園鄉社口村彰南路四段７４號,(049)2521753,436,1714,2020/03/04 10:25:11
5937140054,正明藥局,彰化縣芬園鄉茄荖村芬草路一段２７３號,(049)2523918,409,1598,2020/03/04 10:25:11
5937141104,啟安大藥局,彰化縣芬園鄉芬草路２段２３０號,(049)2522858,554,712,2020/03/04 10:25:11
5937141159,強生藥局,彰化縣芬園鄉社口村光復路２０號,(049)2521857,338,1016,2020/03/04 10:25:11
5937150019,天德藥師藥局,彰化縣大村鄉擺塘村中正西路６１號,(04)8525256,46,184,2020/03/04 10:25:11
5937150032,大欣藥局,彰化縣大村鄉村上村中正西路１９號,(04)8524803,47,667,2020/03/04 10:25:11
5937151075,郭藥局,彰化縣大村鄉茄苳路１段１３２號,(04)8522988,74,208,2020/03/04 10:25:11
5937151119,誠品藥局,彰化縣大村鄉大村村茄苳路１段２３３號,(04)8529206,170,744,2020/03/04 10:25:11
5937151128,五行藥局,彰化縣大村鄉黃厝村１２鄰山腳路２－２６號,(04)8527603,1168,1938,2020/03/04 10:25:11
5937151137,萬來藥局,彰化縣大村鄉福興村山腳路８０－９號,(04)8535565,220,764,2020/03/04 10:25:11
5937161115,埔鹽藥局,彰化縣埔鹽鄉埔鹽村彰水路二段８號１樓,(04)8659655,382,849,2020/03/04 10:25:11
5937161124,福氣藥局,彰化縣埔鹽鄉好修村中正路２２９號１樓,(04)8657735,662,544,2020/03/04 10:25:11
5937161133,石埤藥局,彰化縣埔鹽鄉石埤村番金路８０之１６號,(04)8655146,454,902,2020/03/04 10:25:11
5937161151,侯藥師藥局,彰化縣埔鹽鄉中正路２０６號,(04)8651837,298,1026,2020/03/04 10:25:11
5937170034,淑惠藥局,彰化縣埔心鄉亙北村員鹿路一段２４４號,(04)8297798,914,1074,2020/03/04 10:25:11
5937170098,普生藥師藥局,彰化縣埔心鄉東門村中正路１段１４號,(04)8294449,434,1100,2020/03/04 10:25:11
5937171157,安麗兒藥局埔心店,彰化縣埔心鄉義民村員鹿路２段４３４號１樓,(04)8295129,498,448,2020/03/04 10:25:11
5937171166,永康藥局,彰化縣埔心鄉東門村員鹿路２段３２９號１樓,(04)8280957,478,516,2020/03/04 10:25:11
5937171175,旭康專業藥局,彰化縣埔心鄉中興路２３號１樓,(04)8284165,460,832,2020/03/04 10:25:11
5937180030,生春大藥局,彰化縣永靖鄉東門路２３３號,(04)8220929,142,725,2020/03/04 10:25:11
5937180094,天喜生大藥局,彰化縣永靖鄉永西村西門路４１號,(04)8221821,98,406,2020/03/04 10:25:11
5937181215,邱利調劑藥局,彰化縣永靖鄉瑚璉路３０８號,(04)8235509,6,250,2020/03/04 10:25:11
5937181251,金和堂藥局,彰化縣永靖鄉永靖街１０２號,(04)8221759,68,1002,2020/03/04 10:25:11
5937181260,永茗藥局,彰化縣永靖鄉永東村東門路１９８號,(04)8242721,236,344,2020/03/04 10:25:11
5937181279,佳恩藥局,彰化縣永靖鄉永西村瑚璉路３０２號,(04)8235753,599,511,2020/03/04 10:25:11
5937181288,陳厝厝保健藥局,彰化縣永靖鄉永興路２段１１６號,(04)8232387,102,502,2020/03/04 10:25:11
5937181297,永靖藥局,彰化縣永靖鄉瑚璉路１１６號,(04)8230220,802,722,2020/03/04 10:25:11
5937190063,新保和藥局,彰化縣社頭鄉社頭村員集路２段２２４號,(04)8732330,904,1461,2020/03/04 10:25:11
5937190107,張藥局,彰化縣社頭鄉社頭村清水岩路３６７號,(04)8734660,258,928,2020/03/04 10:25:11
5937191131,順天藥局二店,彰化縣社頭鄉員集路２段２９７ 號,(04)8726901,360,412,2020/03/04 10:25:11
5937191159,好生藥局,彰化縣社頭鄉社斗路一段２６１號,(04)8739508,413,888,2020/03/04 10:25:11
5937191195,藥典大藥局,彰化縣社頭鄉清水岩路２３９號,(04)8732497,548,1274,2020/03/04 10:25:11
5937191211,永信藥局,彰化縣社頭鄉社頭村員集路２段１７２號,(04)8732582,438,1104,2020/03/04 10:25:11
5937191248,佳和藥局,彰化縣社頭鄉社頭村員集路２段３３３號,(04)8731331,748,1194,2020/03/04 10:25:11
5937191275,社頭榮生藥局,彰化縣社頭鄉清水岩路２５３號,(04)8732172,176,525,2020/03/04 10:25:11
5937191284,社頭福倫健保藥局,彰化縣社頭鄉員集路二段１０９號,(04)8723318,334,714,2020/03/04 10:25:11
5937200037,安濟藥局,彰化縣二水鄉聖化村員集路三段６４０號,(04)8792593,542,1726,2020/03/04 10:25:11
5937201061,長春藥局,彰化縣二水鄉文化村光文路１０３號,(04)8795289,274,666,2020/03/04 10:25:11
5937201085,豐源藥局,彰化縣二水鄉光化村光化２巷１２號１樓,(04)8796832,794,1702,2020/03/04 10:25:11
5937201105,安利藥局,彰化縣二水鄉光化村員集路４段３號,(04)8794933,792,2106,2020/03/04 10:25:11
5937210015,和成藥局,彰化縣田尾鄉中正路三段２５３號,(04)8227360,370,1504,2020/03/04 10:25:11
5937211094,田尾藥局,彰化縣田尾鄉饒平村光復路２段６６９號,(04)8836725,621,964,2020/03/04 10:25:11
5937211101,溪畔藥局,彰化縣田尾鄉溪畔村中山路２段３９７號,(04)8239016,712,1338,2020/03/04 10:25:11
5937211110,禾欣藥局,彰化縣田尾鄉中山路一段５３９號,(04)8830800,1250,1179,2020/03/04 10:25:11
5937220057,埤頭藥局,彰化縣埤頭鄉合興村斗苑西路２６１號,(04)8922162,304,468,2020/03/04 10:25:11
5937221198,祐幼藥局,彰化縣埤頭鄉合興村彰水路3段496號,(04)8911910,1420,2029,2020/03/04 10:25:11
5937221223,埤頭貓頭鷹藥局,彰化縣埤頭鄉斗苑西路２３０號１樓,(04)8921011,614,752,2020/03/04 10:25:11
5937221232,堃泰中西藥局,彰化縣埤頭鄉斗苑西路２６７號,(04)8928798,528,1362,2020/03/04 10:25:11
5937230035,路上中華藥局,彰化縣芳苑鄉路平村上林路３８８號,(04)8983831,892,1968,2020/03/04 10:25:11
5937230053,彰芳藥局,彰化縣芳苑鄉和平村芳漢路王功段３９１號,(04)8932321,422,1408,2020/03/04 10:25:11
5937231112,杏元藥局,彰化縣芳苑鄉民生村建成路４８巷８號,(04)8931095,1478,1924,2020/03/04 10:25:11
5937231149,新鎮安藥局,彰化縣芳苑鄉仁愛村斗苑路芳苑段１８４號１樓,(04)8986537,1182,1672,2020/03/04 10:25:11
5937231167,芳苑藥局,彰化縣芳苑鄉芳苑村斗苑路芳苑段１９４巷１７號,(04)8986538,983,1125,2020/03/04 10:25:11
5937241038,宜禎藥局,彰化縣大城鄉東城村東平路１７０號,(04)8947246,1646,1911,2020/03/04 10:25:11
5937241065,順順藥局,彰化縣大城鄉東城村東平路６３－１號,(04)8946379,208,814,2020/03/04 10:25:11
5937251105,宏吉藥局,彰化縣竹塘鄉竹塘村仁愛街５０號,(04)8976709,1058,1692,2020/03/04 10:25:11
5937251123,上明藥局,彰化縣竹塘鄉竹塘村竹塘街６６號,(04)8970600,1448,1646,2020/03/04 10:25:11
5937251150,竹塘健保藥局,彰化縣竹塘鄉竹塘村文化街５０號,(04)8976180,434,1136,2020/03/04 10:25:11
5937251169,竹塘張藥局,彰化縣竹塘鄉中興街５６號,(04)8972216,909,1840,2020/03/04 10:25:11
5937260033,呂藥局,彰化縣溪州鄉溪州里中興路１號,(04)8895552,175,1538,2020/03/04 10:25:11
5937261147,益興藥局,彰化縣溪州鄉大庄村中山巷２７號,(04)8802581,808,1939,2020/03/04 10:25:11
5937261165,中榮堂中西藥局,彰化縣溪州鄉中山路３段３６７號,(04)8895636,318,1101,2020/03/04 10:25:11
5937261227,成記大藥局,彰化縣溪州鄉中山路三段３００號,(04)8891788,212,1081,2020/03/04 10:25:11
5938010108,宏嘉藥局,南投縣南投市崇文里彰南路一段１１１４號,(049)2228073,66,738,2020/03/04 10:25:11
5938010153,聖恩藥局,南投縣南投市營北里中正路２３６號１樓,(049)2316366,2,184,2020/03/04 10:25:11
5938010242,惠光藥局,南投縣南投市復興路２１２號,(049)2222633,46,1290,2020/03/04 10:25:11
5938010386,南投藥局,南投縣南投市南投村民族路２８６號,(049)2222607,0,156,2020/03/04 10:25:11
5938010420,弘昌藥局,南投縣南投市三興里南崗一路８５號,(049)2228902,70,556,2020/03/04 10:25:11
5938010546,福倫藥局,南投縣南投市南陽路３４５號,(049)2202918,404,196,2020/03/04 10:25:11
5938011614,廣元藥局,南投縣南投市龍泉里民族路２２７號,(049)2222601,2,68,2020/03/04 10:25:11
5938011730,明安大藥局,南投縣南投市復興路４８７、４８９號,(049)2248922,508,420,2020/03/04 10:25:11
5938011785,健美藥局,南投縣南投市民權街９８號,(049)2207785,0,216,2020/03/04 10:25:11
5938011810,南投丁丁藥局,南投縣南投市南投里３鄰民族路２５４號,(049)2245977,2,54,2020/03/04 10:25:11
5938011829,和康藥局,南投縣南投市復興路７５－１號,(049)2227008,0,162,2020/03/04 10:25:11
5938011838,愛馨藥局,南投縣南投市中山街１４巷１５號,(049)2206006,38,372,2020/03/04 10:25:11
5938011847,南投啄木鳥藥局,南投縣南投市中興路６１２號,(049)2241683,100,172,2020/03/04 10:25:11
5938011856,南陽健寶藥局,南投縣南投市南陽路４７７號１樓,(049)2243052,362,1090,2020/03/04 10:25:11
5938020079,仁和藥局,南投縣埔里鎮薰化里中山路三段９７號,(049)2985470,282,1476,2020/03/04 10:25:11
5938020088,佳民藥局,南投縣埔里鎮薰化里南昌街２８７號,(049)2987151,756,1884,2020/03/04 10:25:11
5938020104,新仁壽藥局,南投縣埔里鎮南門里南榮路１３號１樓,(049)2983210,716,1734,2020/03/04 10:25:11
5938020159,吉生藥局,南投縣埔里鎮南門里南昌街１４５號,(049)2982966,344,967,2020/03/04 10:25:11
5938020257,德林藥局,南投縣埔里鎮大城路２０６號,(049)2915293,411,1186,2020/03/04 10:25:11
5938021423,黎明藥局,南投縣埔里鎮中正路４６２號,(049)2990941,2178,1296,2020/03/04 10:25:11
5938021432,東風中西藥局,南投縣埔里鎮南昌街３０９號,(049)2903112,1045,1728,2020/03/04 10:25:11
5938021521,大家好藥局,南投縣埔里鎮中山路２段２６２－１號,(049)2995876,860,544,2020/03/04 10:25:11
5938021638,大善藥局,南投縣埔里鎮東峰路１９之１號,(049)2930395,1407,1334,2020/03/04 10:25:11
5938021683,埔里啄木鳥藥局,南投縣埔里鎮中山路三段４６７號,(049)2914510,238,569,2020/03/04 10:25:11
5938021745,欣欣藥局,南投縣埔里鎮中正路３８５號,(049)2421931,1262,788,2020/03/04 10:25:11
5938021772,集成藥局,南投縣埔里鎮南興街２７０號,(049)2992837,282,418,2020/03/04 10:25:11
5938021781,幸福藥局,南投縣埔里鎮中正路５４８號,(049)2999800,268,1116,2020/03/04 10:25:11
5938021790,健豐藥局,南投縣埔里鎮和四街３號,(049)2423221,510,888,2020/03/04 10:25:11
5938021852,高品藥局,南投縣埔里鎮南昌街２００號,(049)2421616,376,1464,2020/03/04 10:25:11
5938021914,好安心藥局,南投縣埔里鎮中山路二段３２７號,(049)2990377,46,528,2020/03/04 10:25:11
5938021932,喜樂藥局,南投縣埔里鎮和平東路４１５號,(049)2999992,714,1760,2020/03/04 10:25:11
5938021941,光田藥局,南投縣埔里鎮南門里南榮路１２號,(049)2982830,274,943,2020/03/04 10:25:11
5938021969,宜康健保藥局,南投縣埔里鎮南昌街２６１號,(049)2904170,748,1320,2020/03/04 10:25:11
5938022000,禾安康藥局,南投縣埔里鎮南昌街２１９號１樓,(049)2900219,336,862,2020/03/04 10:25:11
5938022019,安欣藥局,南投縣埔里鎮中山路三段９８號,(04)2906620,1562,1752,2020/03/04 10:25:11
5938022046,品安藥局,南投縣埔里鎮中正路５６３號,(049)2990050,616,1710,2020/03/04 10:25:11
5938022064,大樹埔里藥局,南投縣埔里鎮中正路４３８號,(049)2980805,464,1651,2020/03/04 10:25:11
5938022117,埔里福倫健保藥局,南投縣埔里鎮中山路二段３６７號,(049)2999118,520,1650,2020/03/04 10:25:11
5938022126,埔里能安藥局,南投縣埔里鎮西安路一段６６號,(049)2986578,573,1744,2020/03/04 10:25:11
5938022135,草新健保藥局,南投縣埔里鎮中山路二段３９０號,(049)2901689,538,1020,2020/03/04 10:25:11
5938022144,久泰藥局,南投縣埔里鎮南興街３２４、３２６號,(049)2980968,1032,796,2020/03/04 10:25:11
5938022153,誠光藥局,南投縣埔里鎮中正路５９９號,(049)2987721,428,858,2020/03/04 10:25:11
5938030057,萬壽堂藥局,南投縣草屯鎮中山街２１１號,(049)2333570,397,617,2020/03/04 10:25:11
5938030075,新慈仁藥局,南投縣草屯鎮山腳里虎山路１３０號,(049)2335426,0,786,2020/03/04 10:25:11
5938030084,國聖藥局,南投縣草屯鎮芬草路１段３５號,(049)2305685,397,532,2020/03/04 10:25:11
5938030100,環球大藥局,南投縣草屯鎮中正路７５３號,(049)2356485,0,52,2020/03/04 10:25:11
5938030191,建林藥局,南投縣草屯鎮復興路７３４號,(049)2336449,265,803,2020/03/04 10:25:11
5938030235,久長安藥局,南投縣草屯鎮碧山路９８號,(049)2333256,266,1238,2020/03/04 10:25:11
5938030253,健泰藥局,南投縣草屯鎮碧峰里碧山路１０８２號,(049)2336280,98,575,2020/03/04 10:25:11
5938030280,易生藥局,南投縣草屯鎮明正里芬草路一段１５３號,(049)2323350,212,296,2020/03/04 10:25:11
5938030379,豐安藥局,南投縣草屯鎮中正路１２１９號,(049)2334412,84,570,2020/03/04 10:25:11
5938030735,草屯福倫藥局,南投縣草屯鎮中山街１４２號,(049) 2314218,0,243,2020/03/04 10:25:11
5938032140,東洋藥局,南投縣草屯鎮中正路７９３號,(049)2336096,202,1184,2020/03/04 10:25:11
5938032220,新豐藥局,南投縣草屯鎮中正路１２３２號,(049)2565127,404,1030,2020/03/04 10:25:11
5938032300,康好藥局,南投縣草屯鎮太平路一段２２５號,(049)2358838,400,616,2020/03/04 10:25:11
5938032328,長頸鹿藥局,南投縣草屯鎮虎山路７８２號,(049)2318125,400,208,2020/03/04 10:25:11
5938032355,炎峰藥局,南投縣草屯鎮虎山路７３２號,(049)2380840,80,520,2020/03/04 10:25:11
5938032373,和平藥局,南投縣草屯鎮和平街２９號,(049)2310085,550,1476,2020/03/04 10:25:11
5938032391,祥暘藥局,南投縣草屯鎮中正路８２２、８２４號,(049)2353393,298,236,2020/03/04 10:25:11
5938032408,草屯丁丁藥局,南投縣草屯鎮太平路二段１７９號,(049)2330058,411,777,2020/03/04 10:25:11
5938032417,虎山藥局,南投縣草屯鎮虎山路４８９－１號,(049)2371389,377,640,2020/03/04 10:25:11
5938032453,福安藥局,南投縣草屯鎮碧山路９３號,(049)2333349,26,432,2020/03/04 10:25:11
5938032462,百康藥局,南投縣草屯鎮新豐路７２８巷３４號,(049)2362033,0,38,2020/03/04 10:25:11
5938032471,草屯啄木鳥藥局,南投縣草屯鎮中興路２２號,(049)2323560,396,200,2020/03/04 10:25:11
5938040044,仁山藥局,南投縣竹山鎮昭德街２３號,(049)2657720,1462,1951,2020/03/04 10:25:11
5938040151,快安藥局,南投縣竹山鎮延平里集山路三段１３號,(049)2643048,1087,1776,2020/03/04 10:25:11
