醫事機構代碼,醫事機構名稱,醫事機構地址,醫事機構電話,成人口罩剩餘數,兒童口罩剩餘數,來源資料時間
5901113269,樂齡藥師藥局,臺北市內湖區內湖路３段１０３號,(02)27919707,186,1577,2020/03/04 10:28:40
5901113296,喜越藥局,臺北市內湖區內湖路１段２８５巷５９弄７號,(02)26271955,6,130,2020/03/04 10:28:40
5901113303,禾康藥局,臺北市內湖區內湖路１段２９６號,(02)26562669,330,130,2020/03/04 10:28:40
5901113312,江南大藥局,臺北市內湖區文德路２２巷９弄５６號,(02)26595430,84,242,2020/03/04 10:28:40
5901113330,躍獅大湖藥局,臺北市內湖區成功路４段３２９號,(02)27945376,0,1250,2020/03/04 10:28:40
5901113349,澴山藥局,臺北市內湖區環山路１段４號,(02)87978793,0,1046,2020/03/04 10:28:40
5901113367,瑞暉藥局,臺北市內湖區文德路１０５號,(02)26276828,262,663,2020/03/04 10:28:40
5901113376,內湖藥局,臺北市內湖區康寧路１段１１６號,(02)27940545,64,2574,2020/03/04 10:28:40
5901113385,躍獅康成藥局,臺北市內湖區成功路４段６１巷１１號,(02)87922031,294,1142,2020/03/04 10:28:40
5901113394,富康文德藥局,臺北市內湖區文德路２２巷２７弄４號,(02)26272000,0,692,2020/03/04 10:28:40
5901113401,躍獅麗湖藥局,臺北市內湖區內湖路１段４０１之１號,(02)26276160,68,336,2020/03/04 10:28:40
5901113438,晶龍藥局,臺北市內湖區成功路４段２１８號,(02)27956255,0,1482,2020/03/04 10:28:40
5901113456,佑全內湖康寧藥局,臺北市內湖區康寧路３段３９號、３９號２樓、４１號、４３號,(02)26346578,0,276,2020/03/04 10:28:40
5901113509,安安藥局,臺北市內湖區康寧路１段４２號,(02)87912187,0,212,2020/03/04 10:28:40
5901113527,杏一港墘藥局,臺北市內湖區港墘路８３號,(02)87978746,0,552,2020/03/04 10:28:40
5901113536,原大藥局,臺北市內湖區內湖路１段７３７巷５０弄５號,(02)26596358,0,217,2020/03/04 10:28:40
5901113545,和康健保藥局,臺北市內湖區文德路６６巷４１號,(02)27997202,0,1188,2020/03/04 10:28:40
5901113554,葫光藥局,臺北市內湖區康寧路３段５４巷６號,(02)26336611,200,122,2020/03/04 10:28:40
5901113563,耀元藥局,臺北市內湖區康樂街１５０號,(02)26337369,0,912,2020/03/04 10:28:40
5901120022,旭村藥局,臺北市南港區興華路１１２號,(02)27820948,0,684,2020/03/04 10:28:40
5901120139,裕成藥局,臺北市南港區玉成街１６６巷１３號,(02)27851227,146,1768,2020/03/04 10:28:40
5901120175,新錦安藥局,臺北市南港區南港路３段３４號,(02)27825218,0,872,2020/03/04 10:28:40
5901120184,仁泰藥局,臺北市南港區同德路２８號,(02)27855464,100,1301,2020/03/04 10:28:40
5901120308,加欣藥局,臺北市南港區南港路２段２６號,(02)27836222,2,160,2020/03/04 10:28:40
5901121421,祥安藥局,臺北市南港區中坡南路２５號,(02)26547322,0,1444,2020/03/04 10:28:40
5901121449,麗康藥局,臺北市南港區同德路５１號,(02)26515236,0,1752,2020/03/04 10:28:40
5901121501,親親藥局,臺北市南港區玉成街１４０巷７號１樓,(02)26537635,108,1120,2020/03/04 10:28:40
5901121574,上丞藥師藥局,臺北市南港區成福路１０號１樓,(02)26535589,174,315,2020/03/04 10:28:40
5901121583,健園藥局,臺北市南港區研究院路１段１９號１樓,(02)27851567,100,1223,2020/03/04 10:28:40
5901121592,忠孝藥局,臺北市南港區成福路１６號,(02)27862829,148,1734,2020/03/04 10:28:40
5901121618,新東發藥局,臺北市南港區成福路１９８號,(02)27855190,206,1016,2020/03/04 10:28:40
5901121627,富康活力藥局,臺北市南港區研究院路１段１０１巷８號,(02)27828810,4,394,2020/03/04 10:28:40
5901121672,亞博藥師藥局,臺北市南港區興華路８１號,(02)27838090,156,434,2020/03/04 10:28:40
5901121725,佳龍藥局,臺北市南港區研究院路２段８０號,(02)27885951,400,212,2020/03/04 10:28:40
5901121734,湳港藥局,臺北市南港區研究院路１段１０１巷１２號,(02)27892200,398,595,2020/03/04 10:28:40
5901121798,進慧藥局,臺北市南港區研究院路１段１６３號,(02)27887049,136,1667,2020/03/04 10:28:40
5901121823,儀安健保藥局,臺北市南港區同德路７４號,(02)27859893,400,1809,2020/03/04 10:28:40
5901121841,泓安藥局,臺北市南港區興華路７５號,(02)27861083,126,1159,2020/03/04 10:28:40
5901121850,健涵藥局,臺北市南港區舊莊街１段１４７號,(02)27837285,104,299,2020/03/04 10:28:40
5901121869,南港藥局,臺北市南港區南港路一段１６６號,(02)27829137,34,1069,2020/03/04 10:28:40
5901121896,順翔藥局,臺北市南港區研究院路２段１７０號,(02)27824332,214,1612,2020/03/04 10:28:40
5901121903,景星藥局,臺北市南港區南港路３段２６號,(02)27838816,0,1274,2020/03/04 10:28:40
5901121912,成恩藥局,臺北市南港區成福路２３號,(02)27856602,536,1526,2020/03/04 10:28:40
5901121930,小藥師健保藥局,臺北市南港區福德街３２０之１號,(02)27867002,208,1096,2020/03/04 10:28:40
5901121958,心亮藥局,臺北市南港區玉成街６６之７號,(02)27881677,216,796,2020/03/04 10:28:40
5901121976,杏安藥局,臺北市南港區昆陽街１４０巷１６號,(02)27864119,0,1020,2020/03/04 10:28:40
5901121985,勝安藥局,臺北市南港區舊莊街１段１６５號,(02)27828450,338,2016,2020/03/04 10:28:40
5901122026,杏一中坡藥局,臺北市南港區中坡南路３３號、３５號,(02)27827418,79,2214,2020/03/04 10:28:40
5901122035,成福大藥局,臺北市南港區成福路８號,(02)27859221,4,1933,2020/03/04 10:28:40
5901122044,心心藥局,臺北市南港區研究院路２段７６號,(02)27862586,16,104,2020/03/04 10:28:40
5901150011,南風藥局,臺北市士林區美崙街１９號１樓,(02)28320375,142,992,2020/03/04 10:28:40
5901150057,菁安藥局,臺北市士林區美侖街１３號１樓,(02)28323951,16,568,2020/03/04 10:28:40
5901150128,新興藥局,臺北市士林區德行西路１１７號,(02)28362643,156,974,2020/03/04 10:28:40
5901150146,坤成泰藥局,臺北市士林區大南路４１２號,(02)28813903,160,1443,2020/03/04 10:28:40
5901150235,杏城藥局,臺北市士林區天母東路２４號,(02)28725144,0,148,2020/03/04 10:28:40
5901150244,佳赫藥局,臺北市士林區文昌路４４號,(02)28367202,78,624,2020/03/04 10:28:40
5901150253,文祥藥局,臺北市士林區光華路２６巷２弄２號,(02)28623487,124,2064,2020/03/04 10:28:40
5901150271,建芳藥局,臺北市士林區德行東路１４８號,(02)28357172,338,1532,2020/03/04 10:28:40
5901150280,慈航藥局,臺北市士林區文林路４４１號,(02)28815988,84,187,2020/03/04 10:28:40
5901150342,士林三安藥局,臺北市士林區大南路１１號,(02)28812631,214,1906,2020/03/04 10:28:40
5901150351,啟宏藥局,臺北市士林區大東路９０－１號１樓,(02)28825811,110,1336,2020/03/04 10:28:40
5901150397,博惠藥局,臺北市士林區華榮街１６號,(02)28320379,0,2248,2020/03/04 10:28:40
5901150459,有德堂大藥局,臺北市士林區中山北路６段２２７號,(02)28318387,0,1506,2020/03/04 10:28:40
5901150468,太安藥局,臺北市士林區延平北路５段１５７號,(02)28111468,74,1212,2020/03/04 10:28:40
5901150511,三原藥局,臺北市士林區延平北路５段２９３號,(02)28111888,106,1136,2020/03/04 10:28:40
5901150548,田倉藥局,臺北市士林區士東路１２４號,(02)88662188,0,1350,2020/03/04 10:28:40
5901150575,日康藥局,臺北市士林區士東路１２號１樓,(02)28358558,0,1048,2020/03/04 10:28:40
5901150593,安寧藥局,臺北市士林區劍潭路９１號,(02)28803319,78,1066,2020/03/04 10:28:40
5901150600,環安藥局,臺北市士林區大南路２４４號１樓,(02)28828478,2,1104,2020/03/04 10:28:40
5901150682,加赫藥局,臺北市士林區文昌路７６號,(02)28336362,154,778,2020/03/04 10:28:40
5901150762,麗森藥局,臺北市士林區天母西路５１號,(02)28714152,118,276,2020/03/04 10:28:40
5901150771,天母大和藥師藥局,臺北市士林區德行東路１８９－１號１樓,(02)28310142,131,1299,2020/03/04 10:28:40
5901150815,陽明藥局,臺北市士林區菁山路１０號１樓,(02)28612863,196,2080,2020/03/04 10:28:40
5901151956,康鈺藥局,臺北市士林區德行東路１３３號１樓,(02)28313915,180,1690,2020/03/04 10:28:40
5901152024,今欣藥局,臺北市士林區天母西路４１巷９號１樓,(02)28713129,0,120,2020/03/04 10:28:40
5901152051,士新藥局,臺北市士林區文昌路６２號,(02)28331332,0,289,2020/03/04 10:28:40
5901152079,資生堂藥局,臺北市士林區承德路４段４０巷１７號１Ｆ,(02)28857588,0,952,2020/03/04 10:28:40
5901152122,社子全民藥局,臺北市士林區延平北路５段１２０號,(02)28127412,296,1768,2020/03/04 10:28:40
5901152131,康華藥局,臺北市士林區中山北路７段１４巷２號２樓,(02)28743223,142,1818,2020/03/04 10:28:40
5901152186,詠恩藥局,臺北市士林區延平北路５段３１６號１樓,(02)28119479,254,1846,2020/03/04 10:28:40
5901152293,安泰藥師藥局,臺北市士林區延平北路六段８３號（實際使用：１、２樓）,(02)28166977,0,792,2020/03/04 10:28:40
5901152453,家赫藥局,臺北市士林區忠義街８０號１樓,(02)28346453,6,940,2020/03/04 10:28:40
5901152471,得安藥局,臺北市士林區文林路１４０號,(02)28836336,0,2066,2020/03/04 10:28:40
5901152604,達揚藥局,臺北市士林區社正路３６號１樓,(02)88115559,1,261,2020/03/04 10:28:40
5901152640,仁大藥局,臺北市士林區社子街１３號１樓,(02)88113793,120,1796,2020/03/04 10:28:40
5901152659,和樹藥局,臺北市士林區後港街４５巷１號１樓,(02)28821188,54,476,2020/03/04 10:28:40
5901152686,三光藥局,臺北市士林區延平北路５段３２０號１樓,(02)28123786,178,1706,2020/03/04 10:28:40
5901152720,博信藥局,臺北市士林區延平北路６段６１號,(02)28128295,0,216,2020/03/04 10:28:40
5901152739,芳圓藥局,臺北市士林區社子街２６－１號,(02)28168666,289,1426,2020/03/04 10:28:40
5901152748,柏雅大藥局,臺北市士林區德行西路６４號,(02)88664398,340,380,2020/03/04 10:28:40
5901152793,信光藥局,臺北市士林區文昌路６８號,(02)28366277,0,948,2020/03/04 10:28:40
5901152837,文昌大藥局,臺北市士林區文昌路７２號,(02)28376196,240,2120,2020/03/04 10:28:40
5901152873,幸福藥局,臺北市士林區德行東路１０９巷８號,(02)28346650,58,772,2020/03/04 10:28:40
5901152882,天爵藥局,臺北市士林區中山北路６段４５０巷１號,(02)28733759,34,1846,2020/03/04 10:28:40
5901152971,石川藥師藥局,臺北市士林區忠義街７０號,(02)28385850,158,1024,2020/03/04 10:28:40
5901153058,誼安藥局,臺北市士林區通河街４２號,(02)28851899,52,1628,2020/03/04 10:28:40
5901153101,聖賢藥局,臺北市士林區士商路５８號,(02)28833046,16,824,2020/03/04 10:28:40
5901153110,美麗田藥局,臺北市士林區通河街７８號,(02)28855990,266,444,2020/03/04 10:28:40
5901153245,大東健保藥局,臺北市士林區大東路８６－４號,(02)28834672,244,1616,2020/03/04 10:28:40
5901153263,健揚藥局,臺北市士林區延平北路５段２５１號,(02)28163698,0,534,2020/03/04 10:28:40
5901153272,光榮藥局,臺北市士林區社中街１１８號,(02)28136060,86,436,2020/03/04 10:28:40
5901153325,天母康甯健保藥局,臺北市士林區克強路８號,(02)28366631,0,994,2020/03/04 10:28:40
5901153405,社正藥局,臺北市士林區社正路１２號,(02)28118704,202,1315,2020/03/04 10:28:40
5901153432,大南春天生活藥局,臺北市士林區大南路３１７、３１９號,(02)28882196,400,782,2020/03/04 10:28:40
5901153487,和謙藥局,臺北市士林區社中街３６２號,(02)28165678,130,909,2020/03/04 10:28:40
5901153496,躍獅忠誠藥局,臺北市士林區忠義街７０號,(02)28387948,216,792,2020/03/04 10:28:40
5901153503,祥新藥局,臺北市士林區社子街６５號,(02)28110906,346,1851,2020/03/04 10:28:40
5901153521,天母台安藥局,臺北市士林區天母西路３４號,(02)28728017,2,39,2020/03/04 10:28:40
5901153567,華齡春天生活藥局,臺北市士林區華齡街３６、３８號,(02)28882156,0,272,2020/03/04 10:28:40
5901153585,德行春天生活藥局,臺北市士林區德行東路７６號,(02)28380306,0,76,2020/03/04 10:28:40
5901153610,家安健保藥局,臺北市士林區德行東路１０９巷１１９號,(02)28322182,12,352,2020/03/04 10:28:40
5901153656,德行盛康藥局,臺北市士林區德行東路２０６之１號,(02)28348756,394,934,2020/03/04 10:28:40
5901153665,康佑藥局,臺北市士林區延平北路５段１７６號,(02)28119981,170,1302,2020/03/04 10:28:40
5901153674,愛佳藥局,臺北市士林區承德路４段２２２之１號,(02)28811199,240,616,2020/03/04 10:28:40
5901153683,安奕藥局,臺北市士林區葫蘆街３０巷１２號,(02)28133289,358,1186,2020/03/04 10:28:40
5901153709,全予藥局,臺北市士林區德行東路２２１號,(02)28386955,1,670,2020/03/04 10:28:40
5901153727,前港盛康藥局,臺北市士林區前港街２８號,(02)28831079,156,462,2020/03/04 10:28:40
5901153745,藥本家藥局,臺北市士林區中山北路７段１４巷２６號,(02)28766682,0,389,2020/03/04 10:28:40
5901153781,文林生活健保藥局,臺北市士林區文林路５６２號（實際使用：１樓）,(02)28381971,0,72,2020/03/04 10:28:40
5901153790,天母盛康藥局,臺北市士林區天母東路８巷８４號,(02)28720208,0,470,2020/03/04 10:28:40
5901153807,中山盛康藥局,臺北市士林區中山北路７段１６２號,(02)28771887,74,252,2020/03/04 10:28:40
5901153816,士東台安藥局,臺北市士林區士東路８６之２號（實際使用：１樓）,(02)28315667,0,518,2020/03/04 10:28:40
5901153825,太和堂中西藥局,臺北市士林區大東路７４號（實際使用：１樓）,(02)28814122,62,859,2020/03/04 10:28:40
5901153852,躍獅芝山藥局,臺北市士林區福華路１５４號（實際使用：１樓）,(02)28365822,0,733,2020/03/04 10:28:40
5901153861,佩佩藥局,臺北市士林區中山北路６段１８２號,(02)28382662,62,788,2020/03/04 10:28:40
5901153870,容育藥局,臺北市士林區延平北路６段８號（實際使用：１樓）,(02)28113680,88,626,2020/03/04 10:28:40
5901153889,新光維康藥局,臺北市士林區基河路２５０之３號（實際使用：１樓）,(02)28801011,300,1024,2020/03/04 10:28:40
5901160044,石牌藥局,臺北市北投區石牌路１段４９號,(02)28214986,121,634,2020/03/04 10:28:40
5901160053,天蓮藥局,臺北市北投區石牌路１段１６６巷１１５號,(02)28211824,0,1129,2020/03/04 10:28:40
5901160062,丸三大藥局,臺北市北投區自強街１０５號,(02)28230637,396,1159,2020/03/04 10:28:40
5901160099,進春藥局,臺北市北投區明德路１５１號,(02)28216938,168,1412,2020/03/04 10:28:40
5901160142,德昇藥局,臺北市北投區裕民二路２０號,(02)28217565,0,953,2020/03/04 10:28:40
5901160197,川秀藥局,臺北市北投區石牌路２段９９巷９號１樓,(02)28270702,0,460,2020/03/04 10:28:40
5901160222,新祥藥局,臺北市北投區知行路２０８號－１,(02)28582551,0,918,2020/03/04 10:28:40
5901160277,建民藥局,臺北市北投區光明路１６１號,(02)28912339,282,872,2020/03/04 10:28:40
5901160286,昌源藥局,臺北市北投區中央北路４段４８５號,(02)28928695,24,532,2020/03/04 10:28:40
5901160320,益元藥局,臺北市北投區光明路１０６號,(02)28912675,0,1854,2020/03/04 10:28:40
5901160400,世全藥局,臺北市北投區知行路２７３號,(02)28585378,50,1974,2020/03/04 10:28:40
5901160428,九福藥局,臺北市北投區公館路２３６號,(02)28953009,400,566,2020/03/04 10:28:40
5901160517,弘安藥局,臺北市北投區懷德街３３號１樓,(02)28206390,0,1046,2020/03/04 10:28:40
5901160544,黎明藥局,臺北市北投區尊賢街２５３－１號,(02)28223795,219,1581,2020/03/04 10:28:40
5901160562,名山藥局,臺北市北投區東陽街４７５號１樓,(02)28226101,171,1724,2020/03/04 10:28:40
5901160704,明華藥局,臺北市北投區清江路８號（實際使用：１樓）,(02)28971056,162,204,2020/03/04 10:28:40
5901160802,美康藥局,臺北市北投區明德路９０號１樓,(02)28281176,388,856,2020/03/04 10:28:40
5901161890,良興藥局,臺北市北投區中和街２８６號,(02)28933360,0,1686,2020/03/04 10:28:40
5901161934,康揚藥局,臺北市北投區中和街３２２號,(02)28946520,2,4,2020/03/04 10:28:40
5901161961,聯合藥局,臺北市北投區石牌路１段２３號,(02)28270306,452,2144,2020/03/04 10:28:40
5901161998,玉山藥局,臺北市北投區光明路１４５號,(02)28956236,54,1270,2020/03/04 10:28:40
5901162002,實踐藥局,臺北市北投區實踐街１３號,(02)28276616,460,2138,2020/03/04 10:28:40
5901162066,嘉禾大藥局,臺北市北投區中和街２６４號,(02)28984758,0,152,2020/03/04 10:28:40
5901162119,祐鄰藥局,臺北市北投區尊賢街２５０號,(02)28281232,89,1426,2020/03/04 10:28:40
5901162173,小明藥局,臺北市北投區中央南路１段６９號２樓,(02)28928950,0,813,2020/03/04 10:28:40
5901162182,祐民藥局,臺北市北投區中央南路１段２０９號１樓,(02)28975339,0,652,2020/03/04 10:28:40
5901162306,上頤藥局,臺北市北投區中和街３２７號１樓,(02)28981230,0,504,2020/03/04 10:28:40
5901162459,國泰藥師藥局,臺北市北投區自強街１３９－１號,(02)28223995,25,483,2020/03/04 10:28:40
5901162477,長宜藥局,臺北市北投區自強街１１２號,(02)28216605,0,1403,2020/03/04 10:28:40
5901162520,妮妮藥局,臺北市北投區中央南路１段１８７號,(02)28948067,146,1426,2020/03/04 10:28:40
5901162780,康賢藥局,臺北市北投區西安街１段３５９號,(02)28219295,396,1096,2020/03/04 10:28:40
5901162806,大家藥局,臺北市北投區光明路１８２號,(02)28959000,14,1198,2020/03/04 10:28:40
5901162815,天康大藥局,臺北市北投區中央南路１段５７號,(02)28930168,0,884,2020/03/04 10:28:40
5901162833,維康藥局,臺北市北投區石牌路２段１９１．１９３號,(02)28206343,414,891,2020/03/04 10:28:40
5901162879,杏嘉藥局,臺北市北投區清江路６８號,(02)28982340,0,654,2020/03/04 10:28:40
5901163027,躍獅光明藥局,臺北市北投區光明路５１、５３號,(02)28915993,74,460,2020/03/04 10:28:40
5901163107,小豬藥局,臺北市北投區石牌路１段１６６巷８３號,(02)28217099,0,1230,2020/03/04 10:28:40
5901163152,石牌健康人生藥局,臺北市北投區石牌路２段１８７號,(02)28225169,418,1867,2020/03/04 10:28:40
5901163214,鴻恩藥局,臺北市北投區中央南路１段１２９號,(02)28926410,158,935,2020/03/04 10:28:40
5901163241,昱仁藥局,臺北市北投區光明路１０２號２樓,(02)28979050,250,1562,2020/03/04 10:28:40
5901163250,關渡松藥局,臺北市北投區知行路２４７號,(02)28584824,308,1442,2020/03/04 10:28:40
5901163269,佳祈健保藥局,臺北市北投區明德路１４４號,(02)28232535,232,814,2020/03/04 10:28:40
5901163296,天禧大藥局,臺北市北投區實踐街３５號,(02)28213558,360,612,2020/03/04 10:28:40
5901163312,秝安藥局,臺北市北投區石牌路１段６９號（實際使用：１樓）,(02)28215399,298,1758,2020/03/04 10:28:40
5901163330,萬信藥局,臺北市北投區知行路３０５號（實際使用１樓）,(02)28583083,18,444,2020/03/04 10:28:40
5901163376,北投春天藥局,臺北市北投區中央南路１段７６號,(02)28916668,0,104,2020/03/04 10:28:40
5901163394,致遠春天藥局,臺北市北投區致遠一路１段１３２號１、２樓,(02)28253258,2,710,2020/03/04 10:28:40
5901163410,尊賢藥局,臺北市北投區尊賢街２１２號,(02)28270505,0,959,2020/03/04 10:28:40
5901163429,致遠盛康藥局,臺北市北投區致遠二路１４１號,(02)28263580,6,668,2020/03/04 10:28:40
5901163438,漢藥局,臺北市北投區吉利街１４６號,(02)28236598,58,1176,2020/03/04 10:28:40
5901163465,振生大藥局,臺北市北投區中央北路３段６１號,(02)28977292,0,178,2020/03/04 10:28:40
5901163474,怡人藥局,臺北市北投區自強街１６８號,(02)28211598,200,2040,2020/03/04 10:28:40
5901163483,天富大藥局,臺北市北投區石牌路２段１７１號１、２樓,(02)28225812,118,2310,2020/03/04 10:28:40
5901163492,全家藥粧藥局,臺北市北投區光明路１６６－２號,(02)28988685,200,384,2020/03/04 10:28:40
5901163509,吉利春天生活藥局,臺北市北投區吉利街１２０號,(02)28253256,0,250,2020/03/04 10:28:40
5901163518,生活藥局,臺北市北投區光明路２１３號,(02)28933312,0,1205,2020/03/04 10:28:40
5901163527,理得藥局,臺北市北投區石牌路１段１５０號,(02)28289680,244,524,2020/03/04 10:28:40
5901170022,良美藥局,臺北市信義區福德街２６８巷３７號,(02)27593659,250,1976,2020/03/04 10:28:40
5901170040,惠群藥局,臺北市信義區忠孝東路４段５５９巷３８號,(02)27679234,0,424,2020/03/04 10:28:40
5901170059,必欣藥局,臺北市信義區松仁路２６４號,(02)27225060,169,1416,2020/03/04 10:28:40
5901170139,福華藥局,臺北市信義區吳興街２８１巷３號１樓,(02)27208527,0,2207,2020/03/04 10:28:40
5901170184,臺陽藥局,臺北市信義區大道路６１號,(02)27283403,250,1402,2020/03/04 10:28:40
5901170255,松隆藥局,臺北市信義區虎林街６５號,(02)27684033,489,1516,2020/03/04 10:28:40
5901170264,杏康藥局,臺北市信義區忠孝東路５段３７２巷２７弄６８－２號１Ｆ,(02)23457422,325,1862,2020/03/04 10:28:40
5901170335,慧生藥局,臺北市信義區松山路３１０號,(02)27647138,252,2181,2020/03/04 10:28:40
5901170399,文豐藥局,臺北市信義區松山路５４３號－１,(02)27272709,318,1152,2020/03/04 10:28:40
5901170406,鼎泰藥局,臺北市信義區基隆路１段１５５號１樓,(02)27620617,114,300,2020/03/04 10:28:40
5901170433,松山大藥局,臺北市信義區永吉路４３６號,(02)27620624,210,1069,2020/03/04 10:28:40
5901170442,大順安藥局,臺北市信義區吳興街８４號,(02)27360639,104,208,2020/03/04 10:28:40
5901170648,立信藥局,臺北市信義區松山路４０３號,(02)27687754,246,1744,2020/03/04 10:28:40
5901170906,吳興藥局,臺北市信義區吳興街２７９號１樓,(02)27208328,0,1164,2020/03/04 10:28:40
5901170915,杏仁藥局,臺北市信義區大道路１３５號,(02)27262541,0,2152,2020/03/04 10:28:40
5901172071,百康藥局,臺北市信義區基隆路２段１３１之２０號,(02)27364377,0,1414,2020/03/04 10:28:40
5901172160,佑華藥局,臺北市信義區忠孝東路５段５０８－４號１樓,(02)27595719,0,1116,2020/03/04 10:28:40
5901172179,新和平藥局,臺北市信義區虎林街１９８號１樓,(02)23460951,212,1906,2020/03/04 10:28:40
5901172197,得揚藥局,臺北市信義區忠孝東路５段４５２號１樓,(02)87884667,70,1682,2020/03/04 10:28:40
5901172213,華泰藥局,臺北市信義區虎林街８２巷５號,(02)27601992,400,2252,2020/03/04 10:28:40
5901172240,德康大藥局,臺北市信義區松山路５４１巷２１號,(02)27272502,414,1140,2020/03/04 10:28:40
5901172268,皇佳大藥局,臺北市信義區松山路５４１巷１９號,(02)27269868,284,922,2020/03/04 10:28:40
5901172508,好康藥局,臺北市信義區莊敬路４１４號,(02)27232979,240,648,2020/03/04 10:28:40
5901172544,麗中藥局,臺北市信義區福德街２１７號,(02)27594416,66,1094,2020/03/04 10:28:40
5901172580,文興藥局,臺北市信義區福德街２４５號,(02)27590989,1134,2010,2020/03/04 10:28:40
5901172651,康杏藥局,臺北市信義區福德街３０６號１樓,(02)27591510,158,1370,2020/03/04 10:28:40
5901172688,昆陽藥局,臺北市信義區林口街２３０號,(02)27274814,254,1954,2020/03/04 10:28:40
5901172697,綠杏大藥局,臺北市信義區吳興街２４１號,(02)27582378,66,938,2020/03/04 10:28:40
5901172704,鴻濟藥局,臺北市信義區永吉路３２６巷２號１樓,(02)27645331,0,1485,2020/03/04 10:28:40
5901172740,信桉藥局,臺北市信義區莊敬路２３６號,(02)87860005,0,556,2020/03/04 10:28:40
5901172786,安佑藥局,臺北市信義區吳興街２４７號１樓,(02)27222236,24,1414,2020/03/04 10:28:40
5901172820,安心藥局,臺北市信義區永吉路３０巷１４８弄４之１號,(02)27474992,0,738,2020/03/04 10:28:40
5901172839,九州藥局,臺北市信義區和平東路３段２３９號,(02)87323331,198,1674,2020/03/04 10:28:40
5901172857,永吉藥局,臺北市信義區永吉路２１３號,(02)87874043,762,2120,2020/03/04 10:28:40
5901172924,松仁藥局,臺北市信義區松仁路２３３號,(02)27238626,12,1617,2020/03/04 10:28:40
5901172933,喜樂藥局,臺北市信義區松德路１２５號,(02)27275797,14,928,2020/03/04 10:28:40
5901172964,榮泰藥局,臺北市信義區光復南路４１９巷１９號,(02)77296777,0,699,2020/03/04 10:28:40
5901173041,皇昇大藥局,臺北市信義區松山路２１０號１樓,(02)27663488,466,1796,2020/03/04 10:28:40
5901173050,貴臨藥局,臺北市信義區永吉路３２６巷１９號,(02)27493768,88,1419,2020/03/04 10:28:40
5901173176,三立藥局,臺北市信義區忠孝東路５段４９２巷３４號,(02)27271401,0,1742,2020/03/04 10:28:40
5901173201,大鳥藥局,臺北市信義區莊敬路３５４號,(02)23455025,156,1544,2020/03/04 10:28:40
5901173210,濟生中西藥局,臺北市信義區崇德街４１號,(02)27358452,396,1236,2020/03/04 10:28:40
5901173238,正和藥局,臺北市信義區吳興街２２５巷６號,(02)23455186,0,1270,2020/03/04 10:28:40
