醫事機構代碼,醫事機構名稱,醫事機構地址,醫事機構電話,成人口罩剩餘數,兒童口罩剩餘數,來源資料時間
0145080011,衛生福利部花蓮醫院豐濱原住民分院,花蓮縣豐濱鄉豐濱村光豐路４１號,(03)8358141,2441,1482,2020/02/26 14:18:08
0291010010,連江縣立醫院,連江縣南竿鄉復興村２１７號,(083)623995,222,552,2020/02/26 14:18:08
2101010013,松山健康服務中心,台北市松山區八德路４段６９４號１、２樓,(02)27653147,41,875,2020/02/26 14:18:08
2101020019,大安健康服務中心,台北市大安區辛亥路３段１５號,(02)27390997,96,680,2020/02/26 14:18:08
2101090011,大同健康服務中心,台北市大同區昌吉街５２號１至２樓,(02)25948971,0,448,2020/02/26 14:18:08
2101100227,中山健康服務中心,台北市中山區松江路３６７號１樓,(02)25013363,0,615,2020/02/26 14:18:08
2101110027,內湖健康服務中心,台北市內湖區民權東路６段９９號,(02)27908387,1,400,2020/02/26 14:18:08
2101120014,南港健康服務中心,台北市南港區南港路１段３６０號１樓,(02)27868756,1,798,2020/02/26 14:18:08
2101150012,士林健康服務中心,台北市士林區中正路４３９號１樓,(02)28836268,0,695,2020/02/26 14:18:08
2101161033,北投健康服務中心,臺北市北投區石牌路２段１１１號,(02)28261026,0,787,2020/02/26 14:18:08
2101170050,信義健康服務中心,台北市信義區信義路５段１５號,(02)87804152,0,800,2020/02/26 14:18:08
2101180038,中正健康服務中心,台北市中正區牯嶺街２４號,(02)23210168,0,744,2020/02/26 14:18:08
2101191068,萬華健康服務中心,台北市萬華區東園街１５２號,(02)23395384,0,692,2020/02/26 14:18:08
2101200017,政大(文山健康服務中心),臺北市文山區木柵路３段２２０號,(02)22343501,0,800,2020/02/26 14:18:08
2303240013,臺中市中西區衛生所,臺中市西區民權路１０５號,(04)22223811,1384,954,2020/02/26 14:18:08
2311010010,基隆市中正區衛生所,基隆市中正區中正路２３６號２樓,(02)24621632,865,1183,2020/02/26 14:18:08
2311020016,基隆市七堵區衛生所,基隆市七堵區光明路２１－１（１－２樓）,(02)24562008,368,1085,2020/02/26 14:18:08
2311030012,基隆市暖暖區衛生所,基隆市暖暖區暖暖街２８１巷９８號,(02)24572630,1292,1298,2020/02/26 14:18:08
2311040018,基隆市仁愛區衛生所,基隆市仁愛區光一路２６號,(02)24311592,460,1254,2020/02/26 14:18:08
2311050014,基隆市中山區衛生所,基隆市中山區中山二路１５號,(02)24229860,1240,1262,2020/02/26 14:18:08
2311060010,基隆市安樂區衛生所,基隆市安樂區安樂路２段１６４號１樓前棟,(02)24318061,140,560,2020/02/26 14:18:08
2311070016,基隆市信義區衛生所,基隆市信義區信一路６９號,(02)24221633,987,1366,2020/02/26 14:18:08
2312010014,新竹市東區衛生所,新竹市東區民族路４０之２號,(03)5236158,234,604,2020/02/26 14:18:08
2312041028,新竹市北區衛生所,新竹市北區國華街六十九號一樓,(03)5353969,0,433,2020/02/26 14:18:08
2312050018,新竹市香山衛生所,新竹市香山區牛埔里育德街１８８號２樓,(03)5388109,170,484,2020/02/26 14:18:08
2317020010,臺中市東區衛生所,臺中市東區信義街１４２號,(04)22834121,392,886,2020/02/26 14:18:08
2317040012,臺中市南區衛生所,台中市南區工學路７２號２樓,(04)22629735,366,780,2020/02/26 14:18:08
2317050018,臺中市北區衛生所,臺中市北區永興街３０１號４樓,(04)22359182,1106,1108,2020/02/26 14:18:08
2317060014,臺中市西屯區衛生所,臺中市西屯區西安里西屯路二段２９９號,(04)27027068,988,1106,2020/02/26 14:18:08
2317070010,臺中市南屯區衛生所,臺中市南屯區向心南路８１１號１樓,(04)23827640,446,814,2020/02/26 14:18:08
2317080016,台中市北屯區軍功衛生所,台中市北屯區軍功路二段１６號,(04)22393932,1152,1092,2020/02/26 14:18:08
2317081022,台中市北屯區四民衛生所,台中市北屯區后庄路１０６２號,(04)24211945,672,1022,2020/02/26 14:18:08
2321010013,臺南市東區衛生所,台南市東區龍山里林森路１段４１８號,(06)2673613,1432,1244,2020/02/26 14:18:08
2321020019,臺南市南區衛生所,臺南市南區南都里南和路６號,(06)2618578,680,1066,2020/02/26 14:18:08
2321030015,臺南市中西區衛生所,臺南市中西區安海里環河街９４號,(06)2252403,1835,1268,2020/02/26 14:18:08
2321040011,臺南巿北區衛生所,臺南市北區公園里西華街５０號,(06)2252404,1916,1341,2020/02/26 14:18:08
2321060013,台南市安南區衛生所,台南市安南區仁安路７０號２樓,(06)2567406,809,1031,2020/02/26 14:18:08
2321070019,台南市安平區衛生所,台南市安平區平通里育平路３１０號,(06)2996885,928,1109,2020/02/26 14:18:08
2322010017,嘉義市東區衛生所,嘉義市東區大雅路二段６２５號,(05)2750423,1933,1292,2020/02/26 14:18:08
2322020013,嘉義市西區衛生所,嘉義市西區福全里德明路１號,(05)2337355,1278,1100,2020/02/26 14:18:08
2331070012,新北市樹林區衛生所,新北市樹林區樹新路４０－７號１、２樓,(02)26812134,6,563,2020/02/26 14:18:08
2331080018,新北市鶯歌區衛生所,新北市鶯歌區文化路３８９號,(02)26702304,1,666,2020/02/26 14:18:08
2331090014,新北市三峽區衛生所,新北市三峽區光明路７１號３樓,(02)26711592,388,1056,2020/02/26 14:18:08
2331100015,新北市淡水區衛生所,新北市淡水區中山路１５８號,(02)26215620,306,965,2020/02/26 14:18:08
2331120017,新北巿瑞芳區衛生所,新北市瑞芳區明燈路３段１號,(02)24972132,0,792,2020/02/26 14:18:08
2331160011,新北市泰山區衛生所,新北市泰山區全興路２１２號３樓,(02)22962858,62,602,2020/02/26 14:18:08
2331170017,新北市林口區衛生所,新北市林口區忠孝二路５５號,(02)26068760,74,636,2020/02/26 14:18:08
2331180013,新北市深坑區衛生所,新北市深坑區深坑街１６５號１－３樓,(02)26621567,0,994,2020/02/26 14:18:08
2331190019,新北市石碇區衛生所,新北市石碇區潭邊里碇坪路１段８２號,(02)26631325,119,996,2020/02/26 14:18:08
2331200010,新北市坪林區衛生所,新北市坪林區坪林街１０４號,(02)26656272,0,359,2020/02/26 14:18:08
2331210016,新北市三芝區衛生所,新北市三芝區中山路１段１２號,(02)26362007,0,587,2020/02/26 14:18:08
2331220012,新北市石門區衛生所,新北市石門區中山路２８－１號,(02)26381007,644,1072,2020/02/26 14:18:08
2331230018,新北市八里區衛生所,新北市八里區舊城路１６號,(02)26102137,112,748,2020/02/26 14:18:08
2331240014,新北市平溪區衛生所,新北市平溪區公園街１７號１樓,(02)24951015,398,1448,2020/02/26 14:18:08
2331250010,新北市雙溪區衛生所,新北市雙溪區新基南路１８號,(02)24931211,1094,1328,2020/02/26 14:18:08
2331260016,新北市貢寮區衛生所,新北市貢寮區朝陽街７０巷１０號、新北市貢寮區仁愛路１２８號,(02)24901431,94,1048,2020/02/26 14:18:08
2331270012,新北市金山區衛生所,新北市金山區民生路５９號,(02)24982778,0,958,2020/02/26 14:18:08
2331280018,新北市萬里區衛生所,新北市萬里區瑪鍊路１５７號１－３樓及地下１樓,(02)24921117,218,1021,2020/02/26 14:18:08
2331290014,新北市烏來區衛生所,新北市烏來區新烏路５段１０９號,(02)26617200,4,695,2020/02/26 14:18:08
2332030012,桃園市大溪區衛生所,桃園市大溪區仁愛路１號,(03)3882401,388,832,2020/02/26 14:18:08
2332040018,桃園市楊梅區衛生所,桃園市楊梅區校前路４０９號,(03)4750151,332,756,2020/02/26 14:18:08
2332060010,桃園市大園區衛生所,桃園市大園區田心里中正西路１９號,(03)3862024,656,1068,2020/02/26 14:18:08
2332080012,桃園市八德區衛生所,桃園市八德區大華里介壽路二段３６１巷２８號,(03)3662781,99,663,2020/02/26 14:18:08
2332090018,桃園市龍潭區衛生所,桃園市龍潭區中正路２１０號１至２樓,(03)4792033,456,780,2020/02/26 14:18:08
2332100019,桃園市平鎮區衛生所,桃園市平鎮區新富里１鄰振興路１號,(03)4576624,354,700,2020/02/26 14:18:08
2332110015,桃園市新屋區衛生所,桃園市新屋區新屋里中山路２３９號,(03)4772018,114,575,2020/02/26 14:18:08
2332120011,桃園市觀音區衛生所,桃園市觀音區觀新路５８號,(03)4732031,844,1098,2020/02/26 14:18:08
2332130017,桃園市復興區衛生所,桃園市復興區澤仁里中正路２５號,(03)3822325,844,756,2020/02/26 14:18:08
2333010014,新竹縣關西鎮衛生所,新竹縣關西鎮中山路２０７號,(03)5872454,400,200,2020/02/26 14:18:08
2333070010,新竹縣橫山鄉衛生所,新竹縣橫山鄉大肚村３鄰新興街１４１巷１０號,(03)5932004,0,544,2020/02/26 14:18:08
2333090012,新竹縣芎林鄉衛生所,新竹縣芎林鄉文山路５３２號,(03)5924787,400,200,2020/02/26 14:18:08
2333100013,新竹縣寶山鄉衛生所,新竹縣寶山鄉雙溪村７鄰雙園路二段２７３號,(03)5292106,0,392,2020/02/26 14:18:08
2333110019,新竹縣北埔鄉衛生所,新竹縣北埔鄉北埔街９０號,(03)5801677,4,996,2020/02/26 14:18:08
2333120015,新竹縣峨眉鄉衛生所,新竹縣峨眉鄉峨眉村峨眉街２鄰５號,(03)5800314,359,1089,2020/02/26 14:18:08
2333130011,新竹縣尖石鄉衛生所,新竹縣尖石鄉嘉樂村２鄰６１號,(03)5842356,1184,892,2020/02/26 14:18:08
2333140017,新竹縣五峰鄉衛生所,新竹縣五峰鄉大隘村六鄰９９號,(03)5851005,1548,990,2020/02/26 14:18:08
2334010018,宜蘭縣宜蘭市衛生所,宜蘭縣宜蘭市健康路二段２－２號１樓,(03)9322362,774,967,2020/02/26 14:18:08
2334020014,宜蘭縣羅東鎮衛生所,宜蘭縣羅東鎮民生路７９號,(03)9542321,788,1198,2020/02/26 14:18:08
2334030010,宜蘭縣蘇澳鎮衛生所,宜蘭縣蘇澳鎮志成路６０號,(03)9962185,724,932,2020/02/26 14:18:08
2334040016,宜蘭縣頭城鎮衛生所,宜蘭縣頭城鎮吉祥路１５號,(03)9771034,898,1060,2020/02/26 14:18:08
2334050012,宜蘭縣礁溪鄉衛生所,宜蘭縣礁溪鄉礁溪路４段１２６號,(03)9882908,332,738,2020/02/26 14:18:08
2334060018,宜蘭縣壯圍鄉衛生所,宜蘭縣壯圍鄉中央路２段２９０號,(03)9385503,412,925,2020/02/26 14:18:08
2334070014,宜蘭縣員山鄉衛生所,宜蘭縣員山鄉復興路２號,(03)9221575,508,906,2020/02/26 14:18:08
2334081026,宜蘭縣冬山鄉衛生所,宜蘭縣冬山鄉中正路１６號,(03)9594772,392,960,2020/02/26 14:18:08
2334090016,宜蘭縣五結鄉衛生所,宜蘭縣五結鄉五結路２段３３７號,(03)9501564,692,957,2020/02/26 14:18:08
2334100017,宜蘭縣三星鄉衛生所,宜蘭縣三星鄉三星路５段７０號,(03)9892227,96,858,2020/02/26 14:18:08
2334110013,宜蘭縣大同鄉衛生所,宜蘭縣大同鄉崙埤村朝陽４０號,(03)9801175,988,1114,2020/02/26 14:18:08
2334120019,宜蘭縣南澳鄉衛生所,宜蘭縣南澳鄉蘇花路２段３７５號,(03)9981019,1285,802,2020/02/26 14:18:08
2335010012,苗栗縣苗栗市衛生所,苗栗縣苗栗市建民街２８號,(037)277129,248,932,2020/02/26 14:18:08
2335020018,苗栗縣苑裡鎮衛生所,苗栗縣苑裡鎮客庄里公民街１６號,(037)869595,0,612,2020/02/26 14:18:08
2335030014,苗栗縣通霄鎮衛生所,苗栗縣通霄鎮通東里中正路９－６號,(037)752048,0,210,2020/02/26 14:18:08
2335040010,苗栗縣竹南鎮衛生所,苗栗縣竹南鎮大營路２０９號,(037)470152,115,451,2020/02/26 14:18:08
2335050016,苗栗縣頭份市衛生所,苗栗縣頭份市顯會路７２號,(037)663049,0,132,2020/02/26 14:18:08
2335060012,苗栗縣後龍鎮衛生所,苗栗縣後龍鎮大庄里21鄰光華路３７１號,(037)722008,164,844,2020/02/26 14:18:08
2335070018,苗栗縣卓蘭鎮衛生所,苗栗縣卓蘭鎮老庄里中正路１４２號,(04)25892027,808,996,2020/02/26 14:18:08
2335080014,苗栗縣大湖鄉衛生所,苗栗縣大湖鄉明湖村中原路８７號,(037)991034,442,660,2020/02/26 14:18:08
2335090010,苗栗縣公館鄉衛生所,苗栗縣公館鄉館中村大同路７５號,(037)224732,334,550,2020/02/26 14:18:08
2335100011,苗栗縣銅鑼鄉衛生所,苗栗縣銅鑼鄉銅鑼村新興路８１號,(037)981006,4,500,2020/02/26 14:18:08
2335110017,苗栗縣南庄鄉衛生所,苗栗縣南庄鄉東村大同路１７號,(037)822024,16,614,2020/02/26 14:18:08
2335120013,苗栗縣頭屋鄉衛生所,苗栗縣頭屋鄉頭屋村中山街５６巷５４號,(037)253534,316,730,2020/02/26 14:18:08
2335130019,苗栗縣三義鄉衛生所,苗栗縣三義鄉復興路45號,(037)872014,229,904,2020/02/26 14:18:08
2335140015,苗栗縣西湖鄉衛生所,苗栗縣西湖鄉龍洞村１鄰１６號,(037)921211,736,1084,2020/02/26 14:18:08
2335150011,苗栗縣造橋鄉衛生所,苗栗縣造橋鄉造橋村１４鄰８－２號,(037)542755,0,339,2020/02/26 14:18:08
2335160017,苗栗縣三灣鄉衛生所,苗栗縣三灣鄉三灣村親民路１７號,(037)831140,59,779,2020/02/26 14:18:08
2335170013,苗栗縣獅潭鄉衛生所,苗栗縣獅潭鄉新店村１３０之６號,(037)931309,585,1057,2020/02/26 14:18:08
2335180019,苗栗縣泰安鄉衛生所,苗栗縣泰安鄉清安村２鄰７２號,(037)941054,204,809,2020/02/26 14:18:08
2336010016,臺中市豐原區衛生所,臺中市豐原區西勢里中興路１３６號,(04)25261170,423,859,2020/02/26 14:18:08
2336020012,臺中市東勢區衛生所,臺中市東勢區中寧里豐勢路４９０號,(04)25873872,1018,1282,2020/02/26 14:18:08
2336030018,臺中市大甲區衛生所,臺中市大甲區德興路８１號,(04)26872153,294,804,2020/02/26 14:18:08
2336040014,臺中市清水區衛生所,臺中市清水區中山路９２號,(04)26222639,160,794,2020/02/26 14:18:08
2336050010,臺中市沙鹿區衛生所,臺中市沙鹿區洛泉里文昌路２０號,(04)26625040,452,694,2020/02/26 14:18:08
2336060016,臺中市梧棲區衛生所,臺中市梧棲區雲集街７０巷３號,(04)26562809,148,420,2020/02/26 14:18:08
2336070012,臺中市后里區衛生所,台中市后里區墩西里公安路８６號,(04)25562048,464,770,2020/02/26 14:18:08
2336080018,臺中市神岡區衛生所,臺中市神岡區神岡里神岡路２號,(04)25622792,143,362,2020/02/26 14:18:08
2336090014,臺中市潭子區衛生所,臺中市潭子區中山路２段２４１巷５號,(04)25324643,385,920,2020/02/26 14:18:08
2336100015,臺中市大雅區衛生所,臺中市大雅區中清東路２３２號,(04)25661091,138,728,2020/02/26 14:18:08
2336110011,臺中市新社區衛生所,臺中市新社區新社里興社街４段１號,(04)25811704,684,1030,2020/02/26 14:18:08
2336120017,臺中市石岡區衛生所,臺中市石岡區石岡街６號,(04)25721887,498,842,2020/02/26 14:18:08
2336130013,臺中市外埔區衛生所,臺中市外埔區甲后路三段１０６２號,(04)26833208,474,992,2020/02/26 14:18:08
2336140019,臺中市大安區衛生所,臺中市大安區中山南路３３３號,(04)26713681,636,976,2020/02/26 14:18:08
2336150015,臺中市烏日區衛生所,臺中市烏日區烏日里長樂街１３６號,(04)23381027,480,1068,2020/02/26 14:18:08
2336160011,臺中市大肚區衛生所,臺中市大肚區頂街里榮華街１號,(04)26996311,326,846,2020/02/26 14:18:08
2336170017,臺中市龍井區衛生所,臺中市龍井區竹坑里沙田路４段２４３號,(04)26352228,410,736,2020/02/26 14:18:08
2336180013,台中市霧峰區衛生所,台中市霧峰區本堂里民生路１－９號,(04)23393022,518,1010,2020/02/26 14:18:08
2336190019,臺中市太平區衛生所,臺中市太平區中山路１段２１３之１號,(04)23938083,876,1110,2020/02/26 14:18:08
2336200010,臺中市大里區衛生所,臺中市大里區大衛路８２號,(04)24061500,359,950,2020/02/26 14:18:08
2336210025,臺中市和平區衛生所,臺中市和平區南勢里東關路３段１３２號,(04)25942781,1636,1176,2020/02/26 14:18:08
2336210034,臺中市和平區梨山衛生所,臺中市和平區梨山里中正路６８號,(04)25989540,1462,1295,2020/02/26 14:18:08
2337010010,彰化縣彰化市南西北區衛生所,彰化縣彰化市華北里旭光路１６６號,(04)7282141,940,1047,2020/02/26 14:18:08
2337010029,彰化縣彰化市東區衛生所,彰化縣彰化市香山里彰南路２段３４６巷３１弄２６號,(04)7381647,974,1126,2020/02/26 14:18:08
2337020016,彰化縣鹿港鎮衛生所,彰化縣鹿港鎮順興里復興路４２３號,(04)7772309,604,760,2020/02/26 14:18:08
2337030012,彰化縣和美鎮衛生所,彰化縣和美鎮和東里彰美路５段３１９號,(04)7552744,232,435,2020/02/26 14:18:08
2337040018,彰化縣北斗鎮衛生所,彰化縣北斗鎮光復里地政路４０６巷１７號,(04)8882059,1578,1196,2020/02/26 14:18:08
2337050014,彰化縣員林市衛生所,彰化縣員林市仁美里博愛路２２９號,(04)7060230,592,876,2020/02/26 14:18:08
2337060010,彰化縣溪湖鎮衛生所,彰化縣溪湖鎮湖東里青雅路３６號,(04)8815112,1328,1108,2020/02/26 14:18:08
2337070016,彰化縣田中鎮衛生所,彰化縣田中鎮西路里斗中路一段２２２號,(04)8742053,2036,1294,2020/02/26 14:18:08
2337080012,彰化縣二林鎮衛生所,彰化縣二林鎮豐田里斗苑路四段６８９號,(04)8960035,1399,1033,2020/02/26 14:18:08
2337090018,彰化縣線西鄉衛生所,彰化縣線西鄉寓埔村和線路９５７巷２號,(04)7585201,776,824,2020/02/26 14:18:08
2337100019,彰化縣伸港鄉衛生所,彰化縣伸港鄉大同村中興路２段１９７號,(04)7982034,524,840,2020/02/26 14:18:08
2337110015,彰化縣福興鄉衛生所,彰化縣福興鄉福興村福興路５１巷２號,(04)7772371,620,880,2020/02/26 14:18:08
2337120020,彰化縣秀水鄉衛生所,彰化縣秀水鄉安東村中山路２８８號,(04)7693001,772,1040,2020/02/26 14:18:08
2337130017,彰化縣花壇鄉衛生所,彰化縣花壇鄉長沙村中正路１１號,(04)7862035,538,1034,2020/02/26 14:18:08
2337140013,彰化縣芬園鄉衛生所,彰化縣芬園鄉社口村公園１街１１號,(049)2522904,1270,1266,2020/02/26 14:18:08
2337150019,彰化縣大村鄉衛生所,彰化縣大村鄉大村村中正西路３４０號,(04)8520513,482,834,2020/02/26 14:18:08
2337160015,彰化縣埔鹽鄉衛生所,彰化縣埔鹽鄉好修村員鹿路二段５８號,(04)8653596,1038,1084,2020/02/26 14:18:08
2337170011,彰化縣埔心鄉衛生所,彰化縣埔心鄉義民村員鹿路２段３４０號,(04)8294611,664,846,2020/02/26 14:18:08
2337180017,彰化縣永靖鄉衛生所,彰化縣永靖鄉永西村西興路９１號,(04)8221057,574,932,2020/02/26 14:18:08
2337190013,彰化縣社頭鄉衛生所,彰化縣社頭鄉社頭村員集路二段４０９號,(04)8732038,972,1066,2020/02/26 14:18:08
2337200014,彰化縣二水鄉衛生所,彰化縣二水鄉二水村過圳路１９號,(04)8791077,2482,1528,2020/02/26 14:18:08
2337210010,彰化縣田尾鄉衛生所,彰化縣田尾鄉饒平村光復路２段６０８號,(04)8832145,872,939,2020/02/26 14:18:08
2337220016,彰化縣埤頭鄉衛生所,彰化縣埤頭鄉合興村健安街１１９號,(04)8922445,872,1024,2020/02/26 14:18:08
2337230012,彰化縣芳苑鄉衛生所,彰化縣芳苑鄉芳苑村斗苑路芳苑段１９４巷４８號,(04)8983134,2402,1382,2020/02/26 14:18:08
2337240018,彰化縣大城鄉衛生所,彰化縣大城鄉大城村中平路１２６號,(04)8941323,1190,1208,2020/02/26 14:18:08
2337250014,彰化縣竹塘鄉衛生所,彰化縣竹塘鄉竹塘村竹林路１段３０４號,(04)8972009,2020,1348,2020/02/26 14:18:08
2337260010,彰化縣溪州鄉衛生所,彰化縣溪州鄉尾厝村溪下路５７０號,(04)8895023,1198,1256,2020/02/26 14:18:08
2338010014,南投縣南投市衛生所,南投縣南投市三和里三和一路１３號,(049)2223264,0,521,2020/02/26 14:18:08
2338020010,南投縣埔里鎮衛生所,南投縣埔里鎮中山路二段２５６號,(049)2982157,1096,1018,2020/02/26 14:18:08
2338030016,南投縣草屯鎮衛生所,南投縣草屯鎮草溪路８８２巷７號,(049)2362023,502,782,2020/02/26 14:18:08
2338040012,南投縣竹山鎮衛生所,南投縣竹山鎮公所路１２６號,(049)2642026,2726,1446,2020/02/26 14:18:08
2338050018,南投縣集集鎮衛生所,南投縣集集鎮民生路１０６號,(049)2762015,348,912,2020/02/26 14:18:08
2338060014,南投縣名間鄉衛生所,南投縣名間鄉中正村彰南路４２號,(049)2732135,516,960,2020/02/26 14:18:08
2338070010,南投縣鹿谷鄉衛生所,南投縣鹿谷鄉中正路二段２０號,(049)2752002,307,916,2020/02/26 14:18:08
2338080016,南投縣中寮鄉衛生所,南投縣中寮鄉永平村永昌街１０２號,(049)2691404,0,600,2020/02/26 14:18:08
2338090012,南投縣魚池鄉衛生所,南投縣魚池鄉東池村魚池街１９４號,(049)2895513,1028,1124,2020/02/26 14:18:08
2338100013,南投縣國姓鄉衛生所,南投縣國姓鄉國姓村民族街４２號,(049)2721009,1634,1262,2020/02/26 14:18:08
2338110019,南投縣水里鄉衛生所,南投縣水里鄉博愛路２０５號,(049)2770079,1664,1260,2020/02/26 14:18:08
2338120015,南投縣信義鄉衛生所,南投縣信義鄉明德村玉山路４５號,(049)2791148,598,785,2020/02/26 14:18:08
2338130011,南投縣仁愛鄉衛生所,南投縣仁愛鄉大同村五福巷１７號,(049)2802341,2940,1348,2020/02/26 14:18:08
2339040016,雲林縣西螺鎮衛生所,雲林縣西螺鎮福興里修文路１１０號,(05)5862130,2261,1312,2020/02/26 14:18:08
2339050012,雲林縣土庫鎮衛生所,雲林縣土庫鎮忠正里中山路２５４號,(05)6622638,2313,1206,2020/02/26 14:18:08
2339060018,北港鎮衛生所,雲林縣北港鎮北辰路３號,(05)7832103,1910,1124,2020/02/26 14:18:08
2339070014,雲林縣古坑鄉衛生所,雲林縣古坑鄉西平村中山路３９１號,(05)5821132,2342,1315,2020/02/26 14:18:08
2339100017,雲林縣林內鄉衛生所,雲林縣林內鄉新興路５４號,(05)5892273,1530,1206,2020/02/26 14:18:08
2339110013,雲林縣二崙鄉衛生所,雲林縣二崙鄉崙西村中興路９、１１號,(05)5982004,2066,1097,2020/02/26 14:18:08
2339120019,雲林縣崙背鄉衛生所,雲林縣崙背鄉南陽村南光路３４號,(05)6962009,2180,1324,2020/02/26 14:18:08
2339130015,雲林縣麥寮鄉衛生所,雲林縣麥寮鄉麥豐村光復路４號,(05)6932268,2128,1204,2020/02/26 14:18:08
2339180015,雲林縣四湖鄉衛生所,雲林縣四湖鄉施湖村中山西路１１８號,(05)7872890,2400,1316,2020/02/26 14:18:08
2339200012,雲林縣水林鄉衛生所,雲林縣水林鄉水北村水林路８號,(05)7852612,2539,1340,2020/02/26 14:18:08
2340010015,嘉義縣朴子市衛生所,嘉義縣朴子市安福里光復路４０號,(05)3792037,1632,1290,2020/02/26 14:18:08
2340020011,嘉義縣布袋鎮衛生所,嘉義縣布袋鎮新厝里２１號,(05)3472032,1232,1130,2020/02/26 14:18:08
2340030017,嘉義縣大林鎮衛生所,嘉義縣大林鎮平林里中山路２５２號,(05)2652042,1060,1138,2020/02/26 14:18:08
2340040013,嘉義縣民雄鄉衛生所,嘉義縣民雄鄉中樂村文化路７之２號,(05)2262018,1742,1284,2020/02/26 14:18:08
2340050019,嘉義縣溪口鄉衛生所,嘉義縣溪口鄉溪北村二鄰中山路１號,(05)2691046,2716,1480,2020/02/26 14:18:08
2340060015,嘉義縣新港鄉衛生所,嘉義縣新港鄉宮前村中山路１６７號,(05)3742025,562,1146,2020/02/26 14:18:08
2340070011,嘉義縣六腳鄉衛生所,嘉義縣六腳鄉蒜頭村１５鄰蒜頭７３－１號,(05)3802016,1034,1268,2020/02/26 14:18:08
2340080017,嘉義縣東石鄉衛生所,嘉義縣東石鄉東石村３之７號,(05)3732340,1216,1078,2020/02/26 14:18:08
2340090013,嘉義縣義竹鄉衛生所,嘉義縣義竹鄉仁里村義竹４２２－１號,(05)3412032,1918,1344,2020/02/26 14:18:08
2340100014,嘉義縣鹿草鄉衛生所,嘉義縣鹿草鄉西井村１２鄰長壽路２２６巷２號,(05)3752080,704,1232,2020/02/26 14:18:08
2340110010,嘉義縣太保市衛生所,嘉義縣太保市後潭里４４３號,(05)3711273,1330,1238,2020/02/26 14:18:08
2340120016,嘉義縣水上鄉衛生所,嘉義縣水上鄉水上村正義路１４５號,(05)2682059,835,1080,2020/02/26 14:18:08
2340130012,嘉義縣中埔鄉衛生所,嘉義縣中埔鄉中埔村中埔１３０號之１,(05)2531008,1390,1134,2020/02/26 14:18:08
2340140018,嘉義縣竹崎鄉衛生所,嘉義縣竹崎鄉竹崎村文化路１９－１號,(05)2611264,1248,1121,2020/02/26 14:18:08
2340150014,嘉義縣梅山鄉衛生所,嘉義縣梅山鄉華山路１８號,(05)2621249,1372,1242,2020/02/26 14:18:08
2340160010,嘉義縣番路鄉衛生所,嘉義縣番路鄉下坑村菜公店６０號,(05)2591148,1294,1110,2020/02/26 14:18:08
2340170016,嘉義縣大埔鄉衛生所,嘉義縣大埔鄉大埔村５３－１號,(05)2521214,1026,1108,2020/02/26 14:18:08
2340180012,嘉義縣阿里山鄉衛生所,嘉義縣阿里山鄉樂野村３鄰９７－２號,(05)2561573,1273,959,2020/02/26 14:18:08
2341010019,臺南市新營區衛生所,臺南市新營區大宏里三民路７２號,(06)6329421,2314,1344,2020/02/26 14:18:08
2341020015,臺南市鹽水區衛生所,臺南市鹽水區武廟路１號,(06)6521041,1318,1212,2020/02/26 14:18:08
2341030011,臺南市白河區衛生所,臺南市白河區永安里國光路５號,(06)6852014,2412,1326,2020/02/26 14:18:08
2341040017,臺南市麻豆區衛生所,臺南市麻豆區巷口里興國路１１一１號,(06)5722215,1698,1262,2020/02/26 14:18:08
2341050013,臺南市佳里區衛生所,臺南市佳里區東寧里進學路１５９號,(06)7224106,2489,1390,2020/02/26 14:18:08
2341060019,臺南市新化區衛生所,臺南市新化區健康路十三鄰１４３號,(06)5905398,1222,1240,2020/02/26 14:18:08
