醫事機構代碼,醫事機構名稱,醫事機構地址,醫事機構電話,成人口罩剩餘數,兒童口罩剩餘數,來源資料時間
5903280398,元生連鎖保健藥局,臺中市南屯區大墩路９２２號１樓,(04)23273267,528,1267,2020/03/01 15:48:09
5903280450,瑞安藥局,臺中市南屯區大墩路２６１號,(04)24750818,97,843,2020/03/01 15:48:09
5903280487,康詮藥師藥局,臺中市南屯區大墩路７３２號,(04)23286688,774,1496,2020/03/01 15:48:09
5903280521,百康健保藥局,臺中市南屯區黎明路二段３６３號,(04)22547776,0,696,2020/03/01 15:48:09
5903280549,仁幼藥局,臺中市南屯區黎明東街１５１號,(04)23809162,696,400,2020/03/01 15:48:09
5903280567,康總藥局,臺中市南屯區南屯路二段１０１號１樓,(04)24735285,205,978,2020/03/01 15:48:09
5903280576,佑全黎明藥局,臺中市南屯區黎明路２段２６６號,(04)23805560,6,1030,2020/03/01 15:48:09
5903280585,康得藥局,臺中市南屯區向上路三段４５號,(04)23820981,1197,1394,2020/03/01 15:48:09
5903280594,東林藥局,臺中市南屯區黎明路二段１４０號,(04)23810567,38,880,2020/03/01 15:48:09
5903280601,方昇藥局,臺中市南屯區大墩路８１３號１樓,(04)23288818,806,914,2020/03/01 15:48:09
5903280638,心靜藥局,臺中市南屯區黎明路一段１１３８號,(04)23823977,566,977,2020/03/01 15:48:09
5903280647,澄光人文藥局,臺中市南屯區干城街３０５號,(04)22530303,0,440,2020/03/01 15:48:09
5903280656,熊大心藥局,臺中市南屯區河南路四段３７６號,(04)22516252,306,965,2020/03/01 15:48:09
5903280665,和平藥師藥局,臺中市南屯區大墩十街１９２號,(04)23260008,0,268,2020/03/01 15:48:09
5903280683,詠悅藥局,臺中市南屯區大墩十二街６３７號,(04)22515012,64,496,2020/03/01 15:48:09
5903280692,富康藥局,臺中市南屯區大墩路３２３號１樓,(04)24722677,304,1206,2020/03/01 15:48:09
5903280718,樂活藥局,臺中市南屯區大聖街３３２號１樓,(04)23106301,1038,1450,2020/03/01 15:48:09
5903280727,大樹南屯藥局,臺中市南屯區向上路一段６４３號１樓,(04)24758887,1162,1500,2020/03/01 15:48:09
5903280736,大育藥局,臺中市南屯區東興路二段７１號１樓,(04)24755656,334,1106,2020/03/01 15:48:09
5903280745,亨宇藥局,臺中市南屯區東興路二段２９－２號１樓,(04)24711206,1461,1392,2020/03/01 15:48:09
5903280754,弘泰藥師藥局,臺中市南屯區向心南路９４８號１樓,(04)24750790,0,160,2020/03/01 15:48:09
5903280763,全順藥局,臺中市南屯區永春東路３３９號１樓,(04)24730983,430,552,2020/03/01 15:48:09
5903280781,美十樂藥局,臺中市南屯區東興路二段２７９號１樓,(04)24710219,0,936,2020/03/01 15:48:09
5903280790,統一藥局,臺中市南屯區黎明路一段１１９號１樓,(04)24701996,0,128,2020/03/01 15:48:09
5903290045,康美得藥局,臺中市北屯區昌平路１段１０５－８號,(04)22467128,0,656,2020/03/01 15:48:09
5903290063,承恩藥局,臺中市北屯區北屯路４４１－１號１樓,(04)22467857,736,1370,2020/03/01 15:48:09
5903290090,瑞士藥局,臺中市北屯區北屯路１９２－３號１樓,(04)22344853,982,1242,2020/03/01 15:48:09
5903290125,中貞藥局,臺中市北屯區松竹路２段３０５號,(04)22412305,172,994,2020/03/01 15:48:09
5903290198,健康達人藥局,臺中市北屯區遼寧路１段６３號,(04)22471172,44,626,2020/03/01 15:48:09
5903290232,弘映藥局,臺中市北屯區崇德路２段４６７號,(04)22464485,0,285,2020/03/01 15:48:09
5903290312,大連大愛藥局,臺中市北屯區大連路２段２２１號,(04)22428899,680,1428,2020/03/01 15:48:09
5903290385,元復藥局,臺中市北屯區東山路１段２２５－７號,(04)24362075,487,1112,2020/03/01 15:48:09
5903290394,億銓藥局,臺中市北屯區北屯路２１０－１號,(04)22313670,288,1174,2020/03/01 15:48:09
5903290456,百禾藥局中清店,臺中市北屯區中清路２段６００號１樓,(04)22980980,470,1538,2020/03/01 15:48:09
5903290483,兩隻老虎藥局,臺中市北屯區崇德路２段１２號,(04)22364635,199,1571,2020/03/01 15:48:09
5903290518,佳美藥局,臺中市北屯區東山路１段２６５號１樓,(04)24363658,6,493,2020/03/01 15:48:09
5903290572,合健藥局,臺中市北屯區大連路一段５４－１號,(04)22951833,0,866,2020/03/01 15:48:09
5903290607,敦化小林健保藥局,臺中市北屯區敦化路１段６６８號,(04)24261881,0,556,2020/03/01 15:48:09
5903290625,又昌中西健保藥局,臺中市北屯區東山路１段２２３號,(04)24375716,1002,1340,2020/03/01 15:48:09
5903290661,康博中西健保藥局,臺中市北屯區后庄一街７號１樓,(04)24252468,391,1357,2020/03/01 15:48:09
5903290689,大德安藥局,臺中市北屯區景賢路２３６號,(04)24378351,10,50,2020/03/01 15:48:09
5903290714,寶昇藥局,臺中市北屯區東山路一段２１６－２４號１樓,(04)24371393,1077,1225,2020/03/01 15:48:09
5903290723,崙湞藥局,臺中市北屯區進化北路４５號,(04)22370189,1021,1791,2020/03/01 15:48:09
5903290732,小蕃茄藥局,臺中市北屯區山西路二段２６２號,(04)22951900,812,858,2020/03/01 15:48:09
5903290750,長幼藥局,臺中市北屯區崇德路二路二段１５７號１樓,(04)22426767,412,776,2020/03/01 15:48:09
5903290778,博宇藥局,臺中市北屯區北屯路３８５之１號,(04)22341479,672,1262,2020/03/01 15:48:09
5903290787,新一代何藥局,臺中市北屯區環中東路二段２６６、２６８號１樓,(04)24364366,197,325,2020/03/01 15:48:09
5903290796,大樹北屯藥局,臺中市北屯區松竹路二段４１１號,(04)22422262,510,534,2020/03/01 15:48:09
5903290803,英全藥局,臺中市北屯區北平路三段３４號,(04)22345179,1,549,2020/03/01 15:48:09
5903290821,昌平炘星藥局,臺中市北屯區昌平路二段１１－３６號,(04)22417616,936,1259,2020/03/01 15:48:09
5903290830,齊方藥局,臺中市北屯區四平路３９號,(04)22912192,0,736,2020/03/01 15:48:09
5903290849,新盛藥局,臺中市北屯區松竹路二段１５７號１樓,(04)22467779,1,832,2020/03/01 15:48:09
5903290876,北屯軍功藥局,臺中市北屯區軍功路一段７５２號,(04)24375111,1362,1334,2020/03/01 15:48:09
5903290885,全成北屯藥局,臺中市北屯區北屯路４３９－１１號１樓,(04)22463518,313,1034,2020/03/01 15:48:09
5903290894,豐禾藥局,臺中市北屯區同榮路１６３號,(04)24260588,0,450,2020/03/01 15:48:09
5903290901,帥帥藥局,臺中市北屯區東山路一段３００－２號,(04)24378188,0,482,2020/03/01 15:48:09
5903290929,微笑藥局,臺中市北屯區昌平路一段３１８號１樓,(04)22432699,664,1032,2020/03/01 15:48:09
5903290938,中清崙湞藥局,臺中市北屯區中清路二段２９６號１樓,(04)22990409,1342,2054,2020/03/01 15:48:09
5903290947,德寶健保藥局,臺中市北屯區熱河路一段７０號１樓,(04)22325511,468,1454,2020/03/01 15:48:09
5903290956,德霖藥局,臺中市北屯區東山路１段２１６－９號１樓,(04)24369526,0,646,2020/03/01 15:48:09
5903290965,崇德藥局,臺中市北屯區崇德路二段３１號,(04)22361331,1062,628,2020/03/01 15:48:09
5903290974,興安永佳藥局,臺中市北屯區興安路一段３３３號１樓,(04)22437876,28,1184,2020/03/01 15:48:09
5903290983,祥和藥局,臺中市北屯區太原路三段１４７號１樓,(04)22369603,0,692,2020/03/01 15:48:09
5905010018,永麗藥師藥局,臺南市新營區三民路７６之１０號,(06)6377898,1527,1827,2020/03/01 15:48:09
5905010027,大安藥局,臺南市新營區中山路２５７號,(06)6322366,742,1730,2020/03/01 15:48:09
5905010036,橘子藥局,臺南市新營區民權路１１８之２號,(06)6351881,402,614,2020/03/01 15:48:09
5905010045,台新藥局,臺南市新營區中正路８６號,(06)6350048,2766,1486,2020/03/01 15:48:09
5905010063,松柏藥局,臺南市新營區新南里新北街１號,(06)6590063,811,897,2020/03/01 15:48:09
5905010072,長壽藥局,臺南市新營區中山路２１９號,(06)6324001,760,1836,2020/03/01 15:48:09
5905010090,菁安連鎖健保藥局民治店,臺南市新營區民治路１０之１號１樓,(06)6351678,1098,1562,2020/03/01 15:48:09
5905010107,李藥師健康藥局,臺南市新營區大宏里民族路２１號,(06)6328359,1614,1528,2020/03/01 15:48:09
5905010116,安全藥局,臺南市新營區民治路６之４４號１樓,(06)6321706,358,980,2020/03/01 15:48:09
5905010125,宏泰大藥局,臺南市新營區新東里東興８街２７號,(06)6327801,18,632,2020/03/01 15:48:09
5905010134,聖佳藥局,臺南市新營區大宏里民治路２９巷２６－１３號１樓,(06)6330623,1429,1528,2020/03/01 15:48:09
5905010152,謙和藥師藥局,臺南市新營區延平路１０１之２號,(06)6322957,980,1646,2020/03/01 15:48:09
5905010161,安佳藥局,臺南市新營區民治路３７４號１樓,(06)6560535,1496,1000,2020/03/01 15:48:09
5905010189,華陞藥局,臺南市新營區三民路１０６號１樓,(06)6329777,2108,670,2020/03/01 15:48:09
5905010214,大樹新營藥局,臺南市新營區民權路７４、７６、７８號１樓,(06)6328300,730,1520,2020/03/01 15:48:09
5905020014,恩加藥局,臺南市鹽水區武廟里三福路７０號,(06)6521346,171,914,2020/03/01 15:48:09
5905030010,美恩健保藥局,臺南市白河區永安里中山路８１號１樓,(06)6858865,486,1364,2020/03/01 15:48:09
5905030038,美尚藥局,臺南市白河區白河里康樂路４３號,(06)6853538,426,1100,2020/03/01 15:48:09
5905030047,大源醫藥局,臺南市白河區中山路１７２之２號,(06)6852306,942,840,2020/03/01 15:48:09
5905030065,安泰藥局,臺南市白河區中正路９３號１樓,(06)6856700,0,668,2020/03/01 15:48:09
5905030074,優生藥局,臺南市白河區新起街２－１９號,(06)6831583,2014,1612,2020/03/01 15:48:09
5905040070,華笙藥局,臺南市麻豆區中山路１５０－１０號,(06)5715568,4130,1996,2020/03/01 15:48:09
5905040089,徠德藥局,臺南市麻豆區文昌路１４－２號,(06)5711393,0,458,2020/03/01 15:48:09
5905040105,幸福藥局,臺南市麻豆區光復路１２７號１樓,(06)5720977,762,910,2020/03/01 15:48:09
5905040114,禾泰藥局,臺南市麻豆區中正路５９－３號１樓,(06)5720389,892,1360,2020/03/01 15:48:09
5905040123,麻豆啄木鳥藥局,臺南市麻豆區興國路５６－２２號１樓,(06)5714786,0,168,2020/03/01 15:48:09
5905040132,大樹麻豆藥局,臺南市麻豆區中山路４８、５０號１樓,(06)5716556,474,1050,2020/03/01 15:48:09
5905050012,延平藥局,臺南市佳里區延平路４５號,(06)7236185,1598,1568,2020/03/01 15:48:09
5905050058,佳里啄木鳥藥局,臺南市佳里區六安里六安１７之２２號,(06)7236396,598,856,2020/03/01 15:48:09
5905050094,建昌藥局佳里店,臺南市佳里區光復路３７１號,(06)7221369,644,1181,2020/03/01 15:48:09
5905050156,延興藥局,臺南市佳里區鎮山里延平路７６號１樓,(06)7238544,1486,1240,2020/03/01 15:48:09
5905050165,德昌藥局佳里店,臺南市佳里區光復路２３３號,(06)7232388,750,1062,2020/03/01 15:48:09
5905050192,復佑藥局,臺南市佳里區光復路３１５號１樓,(06)7222771,276,1026,2020/03/01 15:48:09
5905050209,大樹佳里藥局,臺南市佳里區延平路２３７號１樓,(06)7231323,1466,1358,2020/03/01 15:48:09
5905060054,全家康藥師藥局,臺南市新化區北勢里中正路１２０７號,(06)5980866,78,919,2020/03/01 15:48:09
5905060081,新化景惠藥局,臺南市新化區護國里中山路１８５號,(06)5909659,0,574,2020/03/01 15:48:09
5905060090,加賀藥局,臺南市新化區忠孝路２８１號,(06)5983865,1686,1528,2020/03/01 15:48:09
5905060107,新化健保藥局,臺南市新化區中山路５０７號,(06)5983328,0,1198,2020/03/01 15:48:09
5905060116,美華健保藥局,臺南市新化區中山路４８７號１樓,(06)5907859,190,1136,2020/03/01 15:48:09
5905060125,美麗安藥局,臺南市新化區護國里中山路１５０－１號１樓,(06)5909509,1570,1751,2020/03/01 15:48:09
5905060134,得安藥局,臺南市新化區忠孝路１１８號１樓,(06)5981333,1346,744,2020/03/01 15:48:09
5905060143,來德藥局,臺南市新化區護國里中山路２３２號,(06)5800193,1590,1604,2020/03/01 15:48:09
5905060161,和德藥局新化店,臺南市新化區清水里中山路４２０號１樓,(06)5802518,798,1381,2020/03/01 15:48:09
5905070050,晶德昌藥局,臺南市善化區文光里中山路８５號,(06)5856141,14,220,2020/03/01 15:48:09
5905070069,善欣藥局,臺南市善化區光文里大成路９８號１樓,(06)5833363,1960,1539,2020/03/01 15:48:09
5905070096,善美藥局,臺南市善化區中正路４５６號,(06)5852540,134,768,2020/03/01 15:48:09
5905070103,有誼藥局,臺南市善化區文昌里中正路３８７號１樓,(06)5817767,828,938,2020/03/01 15:48:09
5905070112,健登藥局,臺南市善化區大成路２１２號１樓,(06)5831133,1090,1088,2020/03/01 15:48:09
5905070121,大樹善化藥局,臺南市善化區民權路５４、５６、５８號１樓,(06)5830550,248,916,2020/03/01 15:48:09
5905080038,大樹學甲藥局,臺南市學甲區中正路１３５號１樓,(06)7820001,288,1105,2020/03/01 15:48:09
5905080047,生祥大藥局學甲店,臺南市學甲區華宗路３７６號１樓,(06)7838462,1198,1270,2020/03/01 15:48:09
5905090025,中山藥局,臺南市柳營區中山西路二段１４５號１樓,(06)6221696,566,1464,2020/03/01 15:48:09
5905090034,維康藥局柳營店,臺南市柳營區太康里２０１－１０號,(06)6226228,1017,1538,2020/03/01 15:48:09
5905100035,華恩藥局,臺南市後壁區墨林里１９８號,(06)6623491,1041,1687,2020/03/01 15:48:09
5905100062,美尚藥局後壁店,臺南市後壁區後壁里１６８－８號,(06)6871138,602,840,2020/03/01 15:48:09
5905120019,復興藥局,臺南市下營區營前里復興街８７號１樓,(06)6898472,456,1384,2020/03/01 15:48:09
5905120055,維任藥局,臺南市下營區中正北路７號,(06)6892259,1625,1626,2020/03/01 15:48:09
5905120073,壹勝藥局,臺南市下營區中山路二段６６號１樓,(06)6890372,331,1296,2020/03/01 15:48:09
5905120082,尚營藥局,臺南市下營區營前里中正南路５５號１樓,(06)6790155,844,1156,2020/03/01 15:48:09
5905130024,人大藥局,臺南市六甲區中山路７號,(06)6988802,0,256,2020/03/01 15:48:09
5905130033,鄰家藥局,臺南市六甲區甲南里珊瑚路１８號１樓,(06)6982086,0,724,2020/03/01 15:48:09
5905130042,人大聯合藥局,臺南市六甲區中山路８號１樓,(06)6987822,0,768,2020/03/01 15:48:09
5905140011,振安藥局,臺南市官田區隆田里中山路一段６０號,(06)5791810,0,1088,2020/03/01 15:48:09
5905140039,安安藥局隆田店,臺南市官田區中山路一段１５號１樓,(06)5795705,0,790,2020/03/01 15:48:09
5905170019,博士藥師專業藥局,臺南市七股區大埕里３５７號１樓,(06)7874226,1334,1336,2020/03/01 15:48:09
5905170037,建昌藥局,臺南市七股區大寮里１之１１號,(06)7873777,334,1348,2020/03/01 15:48:09
5905180042,建昌藥局漚汪店,臺南市將軍區忠興里１－６號１樓,(06)7941889,266,1204,2020/03/01 15:48:09
5905200012,新視藥局,臺南市新市區中正路３１３號,(06)5990172,390,1336,2020/03/01 15:48:09
5905200030,新和德健保藥局,臺南市新市區中正路３１９－１號,(06)5997603,0,406,2020/03/01 15:48:09
5905200058,欣和德藥局,臺南市新市區中正路２００號,(06)5895658,12,684,2020/03/01 15:48:09
5905200067,華林藥局,臺南市新市區中正路１４３號,(06)5896703,508,824,2020/03/01 15:48:09
5905200085,大樹新市藥局,臺南市新市區中正路４９、５１號１樓,(06)5892552,574,1272,2020/03/01 15:48:09
5905210027,愛心藥師藥局,臺南市安定區港南里港口１４７號,(06)5935104,62,114,2020/03/01 15:48:09
5905210036,一翔藥局,臺南市安定區港南里港口１９６號１樓,(06)5935208,0,520,2020/03/01 15:48:09
5905270041,仁德市安藥師藥局,臺南市仁德區中正西路２５號,(06)2661933,0,864,2020/03/01 15:48:09
5905270087,嘉鶴藥局,臺南市仁德區仁和里二空路９８號１樓,(06)2680608,0,1284,2020/03/01 15:48:09
5905270112,昱欣藥局,臺南市仁德區中正路２段１１８１號１樓,(06)2798970,1400,1666,2020/03/01 15:48:09
5905270121,安麗兒藥局仁德店,臺南市仁德區新田里中正路二段４４５號,(06)2498619,593,796,2020/03/01 15:48:09
5905270149,尚澄藥局,臺南市仁德區中正路二段１０９０號,(06)2705580,1214,1450,2020/03/01 15:48:09
5905270158,佳德藥局,臺南市仁德區德糖路４７０號１樓,(06)2796767,582,1330,2020/03/01 15:48:09
5905270167,和德藥局仁德店,臺南市仁德區仁義里中山路５７６號１樓,(06)2703869,938,1402,2020/03/01 15:48:09
5905270176,大樹仁德藥局,臺南市仁德區中正路二段１１５２號１樓,(06)2797466,1102,1508,2020/03/01 15:48:09
5905270185,朝伯藥局,臺南市仁德區中正路三段１號１樓,(06)2796655,1274,1348,2020/03/01 15:48:09
5905280010,安新藥局,臺南市歸仁區民族北街１７巷１４號,(06)3306008,684,1226,2020/03/01 15:48:09
5905280038,萊德藥局,臺南市歸仁區中山路二段７８號,(06)2305500,0,468,2020/03/01 15:48:09
5905280047,獅甲藥局,臺南市歸仁區六甲里六甲路２０３號,(06)3388387,642,1284,2020/03/01 15:48:09
5905280065,微笑藥局,臺南市歸仁區中山路二段１２５號,(06)2397495,1858,1430,2020/03/01 15:48:09
5905280092,元康保健藥局,臺南市歸仁區中山路二段２２９號,(06)2309055,220,606,2020/03/01 15:48:09
5905280109,大樹青青藥局,臺南市歸仁區中山路三段１２號,(06)2300301,262,580,2020/03/01 15:48:09
5905280118,和雅藥局,臺南市歸仁區民權三街９６號１樓,(06-)2307757,690,1013,2020/03/01 15:48:09
5905280127,義德藥局歸仁店,臺南市歸仁區民權北路７５號１樓,(06)2300399,300,668,2020/03/01 15:48:09
5905280136,悅橙歸仁藥局,臺南市歸仁區大通路４３號１樓,(06)2396660,383,1242,2020/03/01 15:48:09
5905290025,義德藥局,臺南市關廟區關廟里忠孝街７號,(06)5954061,0,614,2020/03/01 15:48:09
5905310031,怡品藥局,臺南市永康區大灣路８７０號,(06)2057346,636,1240,2020/03/01 15:48:09
5905310068,育安藥局,臺南市永康區中興里中華路２７４號,(06)3116850,1160,1582,2020/03/01 15:48:09
5905310157,信仁藥局,臺南市永康區中華西街１４９號,(06)2337755,1773,1659,2020/03/01 15:48:09
5905310184,鹽行健保藥局,臺南市永康區中正南路８６１號,(06)2435112,602,1048,2020/03/01 15:48:09
5905310237,睿禾藥局,臺南市永康區東橋一路１３號,(06)3023868,703,464,2020/03/01 15:48:09
5905310255,濟康藥師藥局,臺南市永康區勝利里勝學路２８１號,(06)3122057,106,779,2020/03/01 15:48:09
5905310264,仁安藥師藥局,臺南市永康區崑山里大仁街６１號,(06)2056055,6,1160,2020/03/01 15:48:09
5905310273,誠康藥局,臺南市永康區中山東路１１３號１樓,(06)3022005,4,507,2020/03/01 15:48:09
5905310291,俐欣藥局,臺南市永康區大仁街２０６號１樓,(06)2050777,608,1169,2020/03/01 15:48:09
5905310308,一加藥局,臺南市永康區正強街２３１號１樓,(06)2023140,464,648,2020/03/01 15:48:09
5905310326,美德生醫藥局,臺南市永康區復國一路４９６號１樓,(06)2030463,0,580,2020/03/01 15:48:09
5905310344,昱賢藥師藥局中正店,臺南市永康區中正路１４１、１４３號１樓,(06)2021535,2,576,2020/03/01 15:48:09
5905310353,家嘉藥局,臺南市永康區復國一路２０６號,(06)3121328,1066,1579,2020/03/01 15:48:09
5905310531,晉大藥局復國店,臺南市永康區復國一路５８２－１號,(06)2025309,162,1068,2020/03/01 15:48:09
5905310540,裕安藥局,臺南市永康區中華二路３８５號,(06)3133251,516,1066,2020/03/01 15:48:09
5905310559,康群藥局,臺南市永康區復國里復華三街７２號,(06)2011839,1334,1532,2020/03/01 15:48:09
5905310568,宜芯健康藥局,臺南市永康區大灣路７３６號１樓,(06)2722622,320,987,2020/03/01 15:48:09
5905310620,台南永康藥局,臺南市永康區中山南路８１６、８１６－１．２．３號,(06)2020201,1750,1646,2020/03/01 15:48:09
5905310639,美日新藥局,臺南市永康區中正北路６２號,(06)2420980,230,168,2020/03/01 15:48:09
5905310657,昂德藥局,臺南市永康區復華里復國一路１５２號１樓,(06)3121220,1274,1667,2020/03/01 15:48:09
5905310693,怡德藥局,臺南市永康區中山路１１８號,(06)2325678,920,1305,2020/03/01 15:48:09
5905310746,珊瑚藥局,臺南市永康區南灣里大灣路５０３號,(06)2054235,998,1738,2020/03/01 15:48:09
5905310755,德昌藥局永康店,臺南市永康區中華路４６２號,(06)3020628,640,1574,2020/03/01 15:48:09
5905310773,長頸鹿藥局,臺南市永康區中華路６８１號,(06)3038515,2952,1422,2020/03/01 15:48:09
5905310791,三欣藥局,臺南市永康區勝利里小東路４２３巷２號１樓,(06)3125808,606,1484,2020/03/01 15:48:09
5905310817,永大啄木鳥藥局,臺南市永康區永大路二段３９７號１樓,(06)2071575,2,226,2020/03/01 15:48:09
5905310826,詠健藥局,臺南市永康區中山路１０２號１樓,(06)2033780,714,1298,2020/03/01 15:48:09
5905310835,中華長億藥局,臺南市永康區中華路７３４、７３６號１樓,(06)3022322,2162,1867,2020/03/01 15:48:09
5905310853,大力藥局大灣店,臺南市永康區大灣路３７６號１樓,(06)2054292,0,1008,2020/03/01 15:48:09
5905310871,晶辰藥局,臺南市永康區大灣里民族路３９６巷１號、３號、３９８號１樓,(06)2733368,1294,1220,2020/03/01 15:48:09
5905310880,永東藥局,臺南市永康區中山路５５號１樓,(06)2318700,284,434,2020/03/01 15:48:09
5905310915,杏安心藥局,臺南市永康區六合里中山南路１２－１號１樓,(06)3029067,1085,1308,2020/03/01 15:48:09
5905310924,永仁藥局,臺南市永康區永大路二段８５號１樓,(06)2730816,1788,1672,2020/03/01 15:48:09
5905310933,樂馨藥局,臺南市永康區中山路８５號１樓,(06)2038100,0,376,2020/03/01 15:48:09
5905310942,大樹南灣藥局,臺南市永康區大灣路５５５號１樓,(06)2728822,28,412,2020/03/01 15:48:09
5905310951,合佑藥局,臺南市永康區安康里中華路６９５－２號１樓,(06)3020147,1535,1398,2020/03/01 15:48:09
5905310960,香柏藥局,臺南市永康區東橋七路１８７號１樓,(06)3027773,0,4,2020/03/01 15:48:09
5905310979,復華藥師藥局,臺南市永康區復興里復華一街１３１號１樓,(06)3123597,22,1106,2020/03/01 15:48:09
5905310988,小東藥局,臺南市永康區小東路５７３號１樓,(06)3127169,1088,1192,2020/03/01 15:48:09
5905310997,新英格蘭藥局,臺南市永康區中華路３９７號１樓,(06)3027648,1526,1544,2020/03/01 15:48:09
5905311001,和德藥局復國店,臺南市永康區復國里復國一路３３９之７號１樓,(06)2038728,900,1334,2020/03/01 15:48:09
5905311010,樂丞藥局,臺南市永康區中正北路６０號１樓,(06)2433319,190,694,2020/03/01 15:48:09
5905311038,莉志藥局,臺南市永康區建國里復國路８７巷３號１樓,(06)3123090,475,1390,2020/03/01 15:48:09
5905320019,英菩藥局,臺南市東區關聖里富農街二段１０８巷１０號１樓,(06)2606723,246,790,2020/03/01 15:48:09
5905320082,鶴龍健保藥局,臺南市東區林森路一段１９０號１樓,(06)2608225,1562,1492,2020/03/01 15:48:09
5905320091,台和群康藥局,臺南市東區崇善路５４７號１樓,(06)2891360,0,50,2020/03/01 15:48:09
5905320135,安麗兒藥局裕農店,臺南市東區裕農路１００號１樓,(06)2377378,25,869,2020/03/01 15:48:09
5905320180,恩泉藥局,臺南市東區崇明路２０７號１樓,(06)3352078,1268,1898,2020/03/01 15:48:09
5905320260,群安健保藥局,臺南市東區復興里自由路三段１５１、１５３號１樓,(06)2690652,74,464,2020/03/01 15:48:09
5905320279,樂群藥局,臺南市東區裕聖里裕義路３３０號１樓,(06)3316218,435,1066,2020/03/01 15:48:09
5905320331,高福藥局,臺南市東區大智里德東街１６８號,(06)2904668,134,512,2020/03/01 15:48:09
5905320368,巴克禮中西藥局,臺南市東區中華東路三段３７７巷８號１樓,(06-)3361100,764,1454,2020/03/01 15:48:09
5905320386,倍加藥局,臺南市東區中西里東門路一段２５５號,(06)2364173,12,0,2020/03/01 15:48:09
5905320420,大漢中西藥局,臺南市東區崇德里崇明路４６５號,(06)2908939,1026,1108,2020/03/01 15:48:09
5905320448,一品健康藥局,臺南市東區崇學里崇學路５０－１號１樓,(06)2896366,1138,1474,2020/03/01 15:48:09
5905320466,佑全中華藥局,臺南市東區中華東路三段２１５號,(06)2906386,1614,1605,2020/03/01 15:48:09
5905320475,美生藥局,臺南市東區德高里自由路一段１６１號１樓,(06)2670035,125,1021,2020/03/01 15:48:09
5905320484,和信藥局,臺南市東區裕農路２７－１號１樓,(06)2348291,724,1423,2020/03/01 15:48:09
5905320519,榮恩藥局,臺南市東區中華東路二段３３７號,(06)3350166,856,1412,2020/03/01 15:48:09
5905320537,舒惠藥局,臺南市東區青年路４３２－６號１樓,(06)2087052,54,1286,2020/03/01 15:48:09
5905320546,佑丞藥局,臺南市東區中華東路二段１２９號,(06)2902709,1228,1766,2020/03/01 15:48:09
5905320555,崇明台安藥局,臺南市東區崇明路３０４號,(06)2900350,8,989,2020/03/01 15:48:09
5905320564,杏一台南崇德藥局,臺南市東區崇德路６７４號,(06)2671939,448,1546,2020/03/01 15:48:09
5905320582,東門啄木鳥藥局,臺南市東區東門路三段２３９號１樓,(06)2884569,26,976,2020/03/01 15:48:09
