醫事機構代碼,醫事機構名稱,醫事機構地址,醫事機構電話,成人口罩剩餘數,兒童口罩剩餘數,來源資料時間
5901173783,北一健康人生藥局,台北市信義區吳興街２５５號,(02)27583945,0,1320,2020/03/01 15:48:09
5901173792,柏愛藥局,台北市信義區基隆路２段１３１之９號,(02)27325472,0,1012,2020/03/01 15:48:09
5901173809,愛維喜藥局,台北市信義區莊敬路２７８號,(02)27586989,0,1500,2020/03/01 15:48:09
5901173818,博亞藥局,台北市信義區莊敬路４６２號,(02)27580506,202,838,2020/03/01 15:48:09
5901173827,松美藥局,台北市信義區市民大道６段３２０號（實際營業地址：１樓）,(02)27651099,34,969,2020/03/01 15:48:09
5901180037,崇信藥局,台北市中正區齊東街８８號,(02)23417557,0,1092,2020/03/01 15:48:09
5901180055,日生大藥局,台北市中正區汀州路１段５３號１樓,(02)23031393,234,1482,2020/03/01 15:48:09
5901180108,三元藥局,台北市中正區三元街１５８號,(02)23052839,0,1410,2020/03/01 15:48:09
5901180126,民生藥局,台北市中正區濟南路２段４５－１號１樓,(02)23416470,0,567,2020/03/01 15:48:09
5901180162,濟仁藥局,台北市中正區濟南路２段２２號,(02)23514576,0,712,2020/03/01 15:48:09
5901180206,大安藥局,台北市中正區新生南路１段１０６號,(02)23213186,0,184,2020/03/01 15:48:09
5901180215,上海聯合藥局,台北市中正區衡陽路３２號１樓,(02)23117744,0,634,2020/03/01 15:48:09
5901180224,中心藥局,台北市中正區汀州路３段１２１號,(02)23689889,1,865,2020/03/01 15:48:09
5901180304,祥全藥局,台北市中正區信義路２段７９巷１５－８號１Ｆ,(02)23939339,0,1684,2020/03/01 15:48:09
5901180322,南昌大藥局,台北市中正區南昌路１段８６號１樓,(02)23510322,0,686,2020/03/01 15:48:09
5901180368,古亭藥局,台北市中正區汀州路３段１１７號,(02)23683618,0,1230,2020/03/01 15:48:09
5901182031,新獻安藥局,台北市中正區羅斯福路１段１５號,(02)23519891,2,1196,2020/03/01 15:48:09
5901182068,永興藥局,台北市中正區汀州路１段９２巷２８號,(02)23050986,20,1514,2020/03/01 15:48:09
5901182086,國杏藥師示範藥局,台北市中正區延平南路１７１巷３號,(02)23811322,0,936,2020/03/01 15:48:09
5901182111,東華藥局,台北市中正區汀州路３段１１３號,(02)23640852,0,1234,2020/03/01 15:48:09
5901182219,連雲藥局,台北市中正區連雲街７９號,(02)23410504,2,500,2020/03/01 15:48:09
5901182228,合泰大藥局,台北市中正區衡陽路２６號,(02)23899977,0,452,2020/03/01 15:48:09
5901182255,全民藥局,台北市中正區廈門街８７號,(02)23695759,2,724,2020/03/01 15:48:09
5901183323,和平藥局,台北市中正區中華路２段４３號,(02)23755303,0,1194,2020/03/01 15:48:09
5901183387,丞良藥局,台北市中正區南昌路１段７８號地下１樓,(02)33938868,116,1472,2020/03/01 15:48:09
5901183396,慶安藥局,台北市中正區徐州路２６號,(02)23582385,0,608,2020/03/01 15:48:09
5901183510,怡誠藥局,台北市中正區汀州路２段２１２號,(02)23626905,0,1400,2020/03/01 15:48:09
5901183529,達昌藥局,台北市中正區汀州路１段２０７號,(02)23390109,0,1476,2020/03/01 15:48:09
5901183645,大愛生活藥局,台北市中正區汀州路２段２３２號,(02)23661155,0,438,2020/03/01 15:48:09
5901183672,博昇藥局,台北市中正區連雲街７２號,(02)23581898,0,200,2020/03/01 15:48:09
5901183716,台醫藥局,台北市中正區公園路３０巷４號,(02)23141202,0,849,2020/03/01 15:48:09
5901183789,佑康大藥局,台北市中正區汀州路２段６４號,(02)23683602,0,886,2020/03/01 15:48:09
5901183798,佳和藥局,台北市中正區黎明里公園路３０號,(02)23117102,0,582,2020/03/01 15:48:09
5901183823,南昌健康人生藥局,台北市中正區南昌路１段１５３號,(02)23969382,16,927,2020/03/01 15:48:09
5901183887,中英大藥局,台北市中正區永綏街６號,(02)23615654,0,786,2020/03/01 15:48:09
5901183896,琪基藥局,台北市中正區杭州南路１段８９號,(02)23414988,0,364,2020/03/01 15:48:09
5901183985,正康藥局,台北市中正區漢口街１段２２號,(02)23712831,64,954,2020/03/01 15:48:09
5901184062,建祥武昌藥局,台北市中正區武昌街１段２９號１樓,(02)23314038,0,333,2020/03/01 15:48:09
5901184071,進達健保藥局,台北市中正區中華路２段４５３號,(02)23039829,0,952,2020/03/01 15:48:09
5901184080,活力健康藥妝藥局,台北市中正區中華路２段３１５巷１號,(02)23392625,266,1141,2020/03/01 15:48:09
5901184106,信康藥局,臺北市中正區南昌路１段１４３號,(02)23961979,0,348,2020/03/01 15:48:09
5901184142,新三醫藥局,台北市中正區汀州路３段１２５號,(02)23648180,11,1088,2020/03/01 15:48:09
5901184179,保德中華藥局,台北市中正區中華路２段１５９號,(02)23027720,110,1171,2020/03/01 15:48:09
5901184213,71恩典藥局,台北市中正區信義路２段７１號,(02)23223371,0,958,2020/03/01 15:48:09
5901184222,豐仁藥局,台北市中正區寧波西街１６１號,(02)23033908,0,1436,2020/03/01 15:48:09
5901184240,立赫健保藥局,台北市中正區新生南路１段１６之２號,(02)33223231,0,710,2020/03/01 15:48:09
5901184259,汀州健康人生藥局,台北市中正區汀州路３段２１１號,(02)23688902,273,1460,2020/03/01 15:48:09
5901184366,宏越藥局,台北市中正區中華路２段３１３巷４號,(02)23050880,434,1560,2020/03/01 15:48:09
5901184375,大盛藥局,台北市中正區中華路１段２１巷１６號,(02)23713838,0,766,2020/03/01 15:48:09
5901184437,安藤健保調劑藥局,台北市中正區南昌路１段１３０號、１３２號,(02)23962120,0,1204,2020/03/01 15:48:09
5901184446,北車維康藥局,台北市中正區青島西路７號,(02)23613623,22,321,2020/03/01 15:48:09
5901184455,躍獅南寧藥局,台北市中正區南昌路１段８１號,(02)23967072,0,46,2020/03/01 15:48:09
5901184464,和眾藥局,台北市中正區忠孝西路１段６號,(02)23818766,0,1416,2020/03/01 15:48:09
5901184473,中力藥局,台北市中正區襄陽路１３之５號、１５號,(02)23313768,2,900,2020/03/01 15:48:09
5901184491,躍獅南門藥局,台北市中正區中華路２段３９巷１０號,(02)23141111,0,262,2020/03/01 15:48:09
5901184508,康呈安藥局,台北市中正區汀州路２段１８７號,(02)23672215,58,164,2020/03/01 15:48:09
5901184517,躍獅東門藥局,台北市中正區金山南路１段１０８之１號,(02)23920339,348,824,2020/03/01 15:48:09
5901184535,桐心藥局,台北市中正區金華街１８之６號１樓,(02)23581663,0,878,2020/03/01 15:48:09
5901190024,長泰藥局,台北市萬華區西園路２段２８０號,(02)23012869,24,1097,2020/03/01 15:48:09
5901190033,世欣藥局,台北市萬華區東園街１７３號１Ｆ,(02)23074263,914,1846,2020/03/01 15:48:09
5901190042,裕和藥局,台北市萬華區萬大路１１５、１１７號,(02)23063219,0,1226,2020/03/01 15:48:09
5901190060,秀全藥局,台北市萬華區開封街２段６６－３號,(02)23811357,0,832,2020/03/01 15:48:09
5901190079,建和藥局,台北市萬華區青年路１６８巷４４號,(02)23010838,0,1404,2020/03/01 15:48:09
5901190104,大嘉藥局,台北市萬華區梧州街６０號,(02)23084402,0,1680,2020/03/01 15:48:09
5901190177,信昌藥局,台北市萬華區長泰街３６號１樓,(02)23054898,0,1296,2020/03/01 15:48:09
5901190211,民和藥局,台北市萬華區民和街５號１樓,(02)23038134,0,318,2020/03/01 15:48:09
5901190220,生活大藥局,台北市萬華區貴陽街２段１２４號,(02)23618609,0,594,2020/03/01 15:48:09
5901190284,民鈺藥局,台北市萬華區環河南路２段１３９號１樓,(02)23084270,0,1433,2020/03/01 15:48:09
5901190408,您永安藥局,台北市萬華區昆明街１６２號,(02)23317119,0,830,2020/03/01 15:48:09
5901190426,皇祥藥局,台北市萬華區萬青街１６５號１樓,(02)23375676,0,1165,2020/03/01 15:48:09
5901190444,安聖藥局,台北市萬華區西園路２段２５６號１Ｆ,(02)23037620,0,702,2020/03/01 15:48:09
5901190515,日昇藥局,台北市萬華區廣州街１２４號,(02)23062975,88,1897,2020/03/01 15:48:09
5901190668,聯慶大藥局,台北市萬華區萬大路３０６號１樓,(02)23039850,0,1432,2020/03/01 15:48:09
5901190686,信義藥局,台北市萬華區青年路２８號,(02)23074599,0,440,2020/03/01 15:48:09
5901190695,益源藥局,台北市萬華區大理街１６０巷２６弄２號,(02)23087321,0,588,2020/03/01 15:48:09
5901190784,欣安藥局,台北市萬華區東園街１９０、１９２號,(02)23327830,0,56,2020/03/01 15:48:09
5901192064,三源藥局,台北市萬華區康定路１９７號,(02)23022111,0,1530,2020/03/01 15:48:09
5901192126,恩達藥局,台北市萬華區梧州街６４號,(02)23024467,0,2098,2020/03/01 15:48:09
5901192144,健華藥局,台北市萬華區康定路３２８號,(02)23063083,66,1662,2020/03/01 15:48:09
5901192153,永康大藥局,台北市萬華區桂林路４９號,(02)23317675,0,1368,2020/03/01 15:48:09
5901192162,寶興大藥局,台北市萬華區寶興街１１９號,(02)23013375,4,166,2020/03/01 15:48:09
5901192180,康之友藥局,台北市萬華區青年路２０號,(02)23011598,200,1460,2020/03/01 15:48:09
5901192233,仁仁藥局,台北市萬華區康定路２１９號,(02)23365545,26,808,2020/03/01 15:48:09
5901192448,健誠大藥局,台北市萬華區環河南路２段１８５號,(02)23042223,0,508,2020/03/01 15:48:09
5901192546,躍獅西園藥局,台北市萬華區西園路２段２６０號,(02)23094063,14,1566,2020/03/01 15:48:09
5901192653,吉安藥局,台北市萬華區廣州街１８２號,(02)23085268,2,1908,2020/03/01 15:48:09
5901192751,好視多藥局,台北市萬華區萬大路２８５號,(02)23018100,0,1230,2020/03/01 15:48:09
5901192822,專品藥局,台北市萬華區長沙街２段７１－１號,(02)23718892,184,640,2020/03/01 15:48:09
5901192831,偉安藥局,台北市萬華區西藏路１０９號,(02)23037186,0,1150,2020/03/01 15:48:09
5901192877,瑞生藥局,台北市萬華區西園路２段２５２號,(02)23012159,0,696,2020/03/01 15:48:09
5901192975,萬華藥局,台北市萬華區萬大路２４８號實際營業地址１樓、２樓,(02)23012221,194,1164,2020/03/01 15:48:09
5901192993,萬華健業藥局,台北市萬華區東園街６８－３號,(02)23012292,0,370,2020/03/01 15:48:09
5901193025,華達藥局,台北市萬華區環河南路２段１７１號,(02)23082785,0,1154,2020/03/01 15:48:09
5901193070,榮勝藥局,台北市萬華區萬大路２３３號,(02)23331121,0,1752,2020/03/01 15:48:09
5901193105,安誠貴陽藥局,台北市萬華區貴陽街２段１４８號,(02)23812190,0,568,2020/03/01 15:48:09
5901193123,千誠北護藥局,台北市萬華區內江街１１４號,(02)23123530,0,774,2020/03/01 15:48:09
5901193132,松本藥局,台北市萬華區西昌街２３３號,(02)23029559,2,1385,2020/03/01 15:48:09
5901193150,日森人文藥局,台北市萬華區和平西路３段１４９號,(02)23082100,0,1115,2020/03/01 15:48:09
5901193169,柏祥藥局,台北市萬華區西藏路１４１號,(02)23018272,0,1133,2020/03/01 15:48:09
5901193178,展源健康藥局,台北市萬華區國興路１０４號,(02)23035179,0,1446,2020/03/01 15:48:09
5901193187,富安藥局,台北市萬華區萬大路４２６號,(02)23377878,0,527,2020/03/01 15:48:09
5901193196,青年宏越藥局,台北市萬華區青年路４４號,(02)23011037,0,1078,2020/03/01 15:48:09
5901193221,正盛藥局,台北市萬華區中華路２段４３４－１號,(02)23050386,0,908,2020/03/01 15:48:09
5901193230,啟仁藥局,台北市萬華區環河南路２段１７７號,(02)23362771,11,1306,2020/03/01 15:48:09
5901193249,光華藥局,台北市萬華區華西街１９－５號,(02)23613609,0,1610,2020/03/01 15:48:09
5901200070,裕康藥局,台北市文山區木柵路１段１２號,(02)22367756,62,1016,2020/03/01 15:48:09
5901200105,建興藥局,台北市文山區木柵路２段８１號１樓,(02)29399993,0,680,2020/03/01 15:48:09
5901200114,健群藥局,台北市文山區景興路４１號,(02)29328898,0,656,2020/03/01 15:48:09
5901200123,瑞安藥局,台北市文山區溪口街６９－１號１樓,(02)29312888,400,1027,2020/03/01 15:48:09
5901200141,景美藥局,台北市文山區景文街１２５號,(02)29335741,0,652,2020/03/01 15:48:09
5901200187,全銨藥局,台北市文山區木新路３段３４９號１樓,(02)29370689,0,304,2020/03/01 15:48:09
5901200490,永明大藥局,台北市文山區興隆路１段２９７號１樓,(02)29314428,0,1036,2020/03/01 15:48:09
5901200534,日信專業藥局,台北市文山區木柵路２段１３９號１樓,(02)86618322,0,908,2020/03/01 15:48:09
5901201540,逸仙藥師藥局,台北市文山區興隆路２段２１８－１號１樓,(02)29312597,0,52,2020/03/01 15:48:09
5901201568,康宜庭生活藥局,台北市文山區興隆路４段６４號,(02)29385363,0,64,2020/03/01 15:48:09
5901201675,博揚藥局,台北市文山區景興路１８１號,(02)89321707,0,1186,2020/03/01 15:48:09
5901201728,東京晟藥局,台北市文山區辛亥路４段９７號,(02)29356354,0,534,2020/03/01 15:48:09
5901201746,仙瑩藥局,台北市文山區景華街１６６號,(02)89321817,0,1132,2020/03/01 15:48:09
5901201755,銘依藥局,台北市文山區興隆路２段３０１巷４－１號,(02)29308538,6,1134,2020/03/01 15:48:09
5901201826,舒博威藥局,台北市文山區興隆路２段９５巷３號,(02)29306805,2,1288,2020/03/01 15:48:09
5901201835,巧康藥局,台北市文山區木新路３段２６２、２６４號,(02)29372061,38,248,2020/03/01 15:48:09
5901201871,佳醫景美藥局,台北市文山區羅斯福路６段２９０號,(02)86636659,0,740,2020/03/01 15:48:09
5901201951,慶豐好藥局,台北市文山區興隆路４段１３５號１樓,(02)29384775,0,810,2020/03/01 15:48:09
5901202047,華君藥局,台北市文山區興隆路２段６０號,(02)29319510,0,688,2020/03/01 15:48:09
5901202154,安誠藥局,台北市文山區景華街１２４－１號,(02)29308542,0,663,2020/03/01 15:48:09
5901202216,皇興藥師藥局,台北市文山區木柵路２段１２１號,(02)29365553,0,1416,2020/03/01 15:48:09
5901202396,宇康藥局,台北市文山區羅斯福路５段２１８巷７號,(02)29307066,0,720,2020/03/01 15:48:09
5901202583,康宜庭景文藥局,台北市文山區景文街９７號,(02)29302801,0,392,2020/03/01 15:48:09
5901202592,人人健保藥局,台北市文山區保儀路３９號,(02)86610761,0,1107,2020/03/01 15:48:09
5901202627,杏隆藥局,台北市文山區羅斯福路５段２６１號,(02)29313151,0,1009,2020/03/01 15:48:09
5901202645,永源大藥局,台北市文山區興隆路３段３０２號,(02)22396166,0,1088,2020/03/01 15:48:09
5901202654,康宜庭萬隆藥局,台北市文山區羅斯福路５段２０２號,(02)29348662,0,268,2020/03/01 15:48:09
5901202672,美迦藥局,台北市文山區保儀路２３號,(02)29362815,0,798,2020/03/01 15:48:09
5901202681,振大藥局,台北市文山區永安街２２巷１６號,(02)29393385,0,576,2020/03/01 15:48:09
5901202752,躍獅奕新藥局,台北市文山區木新路２段２７５號,(02)22340378,0,590,2020/03/01 15:48:09
5901202789,宜康藥局,台北市文山區保儀路７號,(02)86619862,0,595,2020/03/01 15:48:09
5901202841,欣安景美藥局,台北市文山區景文街７７號,(02)29316008,254,144,2020/03/01 15:48:09
5901202850,北一藥師藥局,台北市文山區木新路３段４７號,(02)22348686,206,1147,2020/03/01 15:48:09
5901202949,萬隆大藥局,台北市文山區羅斯福路５段２１８巷１５號,(02)29334580,0,525,2020/03/01 15:48:09
5901202958,杏一萬安藥局,台北市文山區萬安街１５號,(02)22302126,0,316,2020/03/01 15:48:09
5901202976,健康家藥局,台北市文山區興隆路２段１３３號,(02)29330858,0,1078,2020/03/01 15:48:09
5901202994,躍獅永健藥局,台北市文山區木柵路１段１７７號,(02)77285780,0,726,2020/03/01 15:48:09
5901203026,健康人生藥局,台北市文山區興隆路３段１０６號,(02)29347813,2,946,2020/03/01 15:48:09
5901203044,木新健康人生藥局,台北市文山區木新路３段２０３號,(02)86611465,0,492,2020/03/01 15:48:09
5901203062,大樹文山藥局,台北市文山區興隆路３段１３號（１、２、３樓）,(02)29342226,2,1672,2020/03/01 15:48:09
5901203071,景華盛康藥局,台北市文山區景華街６９號,(02)29310188,0,326,2020/03/01 15:48:09
5901203080,杏一木柵藥局,台北市文山區木柵路３段９８號,(02)29371839,112,932,2020/03/01 15:48:09
5901203106,光明大藥局,台北市文山區忠順街１段６６號,(02)29390275,0,502,2020/03/01 15:48:09
5901203124,福興藥局,台北市文山區福興路５６號,(02)89313868,0,188,2020/03/01 15:48:09
5901203160,路加健康藥局,台北市文山區興隆路２段２２０巷３９號,(02)29302336,0,198,2020/03/01 15:48:09
5901203179,健安藥局,台北市文山區景興路１６５號,(02)29323757,0,966,2020/03/01 15:48:09
5901203188,逸全生活藥局,台北市文山區羅斯福路５段２２２號,(02)29326185,0,948,2020/03/01 15:48:09
5901203204,躍獅新芳藥局,台北市文山區興隆路３段９０號,(02)29308172,19,1061,2020/03/01 15:48:09
5901203213,綠杏萬芳藥局,台北市文山區興隆路３段１１１號,(02)29349516,4,470,2020/03/01 15:48:09
5901203222,躍獅景新藥局,台北市文山區羅斯福路６段３０號,(02)29356221,0,744,2020/03/01 15:48:09
5901203240,大愛幸福藥局,台北市文山區木新路２段２２１號,(02)29379977,0,446,2020/03/01 15:48:09
5901203259,杏一萬芳藥局,台北市文山區興隆路３段１１８號、１１８號２樓,(02)82301606,30,1404,2020/03/01 15:48:09
5901203268,躍獅木柵藥局,台北市文山區指南路１段２８號,(02)86617752,156,1380,2020/03/01 15:48:09
5901203277,大樹景美藥局,台北市文山區羅斯福路６段２３４之１號,(02)29322951,0,1312,2020/03/01 15:48:09
5901203286,康宜庭興隆藥局,台北市文山區興隆路３段２００號,(02)22304866,4,1031,2020/03/01 15:48:09
5901203295,專品政大藥局,台北市文山區指南路２段８號,(02)22343010,134,288,2020/03/01 15:48:09
5901203302,大樹木柵藥局,台北市文山區木柵路３段１０８號、１１０號（１樓、２樓、３樓）,(02)22340110,0,1246,2020/03/01 15:48:09
5901203320,圓鼎藥局,台北市文山區羅斯福路６段４０７號２樓之１,(02)29332010,420,1704,2020/03/01 15:48:09
5902010016,健康藥局,高雄市鹽埕區大仁路１０２號,(07)5510738,0,24,2020/03/01 15:48:09
5902010025,南京藥局,高雄市鹽埕區建國四路３８７號,(07)5514652,4,941,2020/03/01 15:48:09
5902011291,長庚藥局,高雄市鹽埕區五福四路１６３號一樓,(07)5513436,0,1612,2020/03/01 15:48:09
5902011308,昇安藥局,高雄市鹽埕區瀨南街２２５號１樓,(07)5216438,0,1286,2020/03/01 15:48:09
5902011326,和生藥局,高雄市鹽埕區建國四路１７８－２號,(07)5315739,1,832,2020/03/01 15:48:09
5902011335,利百加藥局,高雄市鹽埕區大公路９６號,(07)5511098,0,1672,2020/03/01 15:48:09
5902020012,永松藥局,高雄市鼓山區鼓山三路１３０－１５號,(07)5810657,38,1520,2020/03/01 15:48:09
5902021153,世和藥局,高雄市鼓山區華豐里華夏路１９５號,(07)5522566,0,953,2020/03/01 15:48:09
5902021233,崧柏藥局,高雄市鼓山區華榮路５４３號,(07)5542027,0,604,2020/03/01 15:48:09
5902021242,快安藥局,高雄市鼓山區濱海一路３２號,(07)5514090,4,1190,2020/03/01 15:48:09
5902021331,文山藥局,高雄市鼓山區鼓山二路１６６之８之９號,(07)5315681,425,1247,2020/03/01 15:48:09
5902021377,藍玉藥局,高雄市鼓山區鼓峰里九如四路２００２號,(07)5837528,44,1212,2020/03/01 15:48:09
5902022687,元氣藥局,高雄市鼓山區南屏路５３３號,(07)5555995,0,982,2020/03/01 15:48:09
5902022721,永瑞藥局,高雄市鼓山區華榮路２９８號２樓,(07)5521376,1207,1449,2020/03/01 15:48:09
5902022749,安康藥局,高雄市鼓山區裕誠路１１５５號,(07)5536828,210,1574,2020/03/01 15:48:09
5902022794,定國藥局,高雄市鼓山區九如四路１１３５號,(07)5815858,16,372,2020/03/01 15:48:09
5902022801,裕康中西大藥局,高雄市鼓山區裕誠路１５１９號,(07)5555352,0,1218,2020/03/01 15:48:09
5902022829,弘興藥局,高雄市鼓山區鼓山三路４８－１１號,(07)5612677,0,310,2020/03/01 15:48:09
5902022874,康爾喜藥局,高雄市鼓山區慶豐街５０號,(07)5222650,224,1196,2020/03/01 15:48:09
5902022892,大有藥局,高雄市鼓山區文信路２３６號,(07)5529402,1324,1590,2020/03/01 15:48:09
5902022972,高雄藥局,高雄市鼓山區九如四路９２４號,(07)5610031,58,1096,2020/03/01 15:48:09
5902030063,紅心藥局,高雄市左營區崇德路２５５號,(07)3416697,0,596,2020/03/01 15:48:09
5902030090,宏仁藥局,高雄市左營區左營大路３９０號,(07)5817895,0,544,2020/03/01 15:48:09
5902030205,果貿藥局,高雄市左營區果峰街２２號,(07)5852825,130,2030,2020/03/01 15:48:09
5902030269,立文藥局,高雄市左營區立文路５４號,(07)5572899,486,1076,2020/03/01 15:48:09
5902030287,慈德藥局,高雄市左營重愛路５３號,(07)3416212,799,1353,2020/03/01 15:48:09
5902030303,翔生藥局,高雄市左營區尾南里左營大路５１４號,(07)5827329,0,654,2020/03/01 15:48:09
5902030312,吉辰藥局,高雄市左營區左營大路４１之１號,(07)5815069,0,934,2020/03/01 15:48:09
5902030410,重仁藥局,高雄市左營區左營大路４０８號,(07)5824083,0,1138,2020/03/01 15:48:09
5902030634,有機藥局,高雄市左營區榮耀街３號,(07)3596429,0,1094,2020/03/01 15:48:09
5902030643,新高橋藥局,高雄市左營區民族一路１０２８號,(07)3100696,162,816,2020/03/01 15:48:09
5902031882,崇光藥局,高雄市左營區華夏路７５５號,(07)3452211,0,848,2020/03/01 15:48:09
5902031999,平安藥局,高雄市左營區中華一路５之１號,(07)5833688,1306,2131,2020/03/01 15:48:09
5902032174,光明健保藥局,高雄市左營區翠華路６０１巷８３號,(07)5812499,850,1802,2020/03/01 15:48:09
5902032218,和信藥師健保藥局,高雄市左營區崇德路２６７號,(07)3419363,0,718,2020/03/01 15:48:09
5902032227,政大聯合藥局,高雄市左營區自由三路５０６號,(07)3454713,0,1282,2020/03/01 15:48:09
5902032370,好幸福專業藥局,高雄市左營區明華一路２２０號,(07)5506816,518,940,2020/03/01 15:48:09
5902032432,威林藥局,高雄市左營區華夏路７２１號,(07)3414243,194,995,2020/03/01 15:48:09
5902032441,健怡藥局,高雄市左營區翠峰路４０號,(07)5821891,1108,1860,2020/03/01 15:48:09
5902032450,可達藥局,高雄市左營區榮德街１７７號,(07)3420182,295,936,2020/03/01 15:48:09
5902032487,必健藥局,高雄市左營區自由二路９０號,(07)5584259,6,1140,2020/03/01 15:48:09
5902032521,合康健保藥局,高雄市左營區裕誠路１８８號,(07)5509667,232,1363,2020/03/01 15:48:09
5902032530,杏光藥局,高雄市左營區果峰街４７巷１號１樓,(07)5837060,0,1041,2020/03/01 15:48:09
5902032647,健智美藥局,高雄市左營區富國路９８號,(07)5580888,0,436,2020/03/01 15:48:09
5902032665,安欣藥師藥局,高雄市左營區大順一路５５２號１樓,(07)5506620,1370,1592,2020/03/01 15:48:09
5902032674,辰暘藥局,高雄市左營區富民路１２０號１、２樓,(07)5588545,776,1154,2020/03/01 15:48:09
5902040014,成吉藥局,高雄市楠梓區楠梓東街７４號,(07)3513339,356,718,2020/03/01 15:48:09
5902040041,橘井藥局,高雄市楠梓區楠梓路１２９號,(07)3511869,0,1132,2020/03/01 15:48:09
5902040050,富翔藥局,高雄市楠梓區常德路３０７號,(07)3516365,0,8,2020/03/01 15:48:09
5902040069,新友藥局,高雄市楠梓區萬昌路１１１號,(07)3653534,0,108,2020/03/01 15:48:09
5902040087,世詠藥局,高雄市楠梓區楠都東街１３８號,(07)3539869,653,1146,2020/03/01 15:48:09
5902040096,宗隆藥局,高雄市楠梓區右昌街２２０號,(07)3622203,276,1440,2020/03/01 15:48:09
5902040112,丁丁楠梓藥局,高雄市楠梓區建楠路１３０、１３２、１３４號,(07)3533743,0,234,2020/03/01 15:48:09
5902040158,黃藥局,高雄市楠梓區惠楠里建楠路１８６號,(07)3515700,0,36,2020/03/01 15:48:09
5902040185,東初藥局,高雄市楠梓區楠梓路３２號,(07)3511261,0,460,2020/03/01 15:48:09
5902040210,益民藥局,高雄市楠梓區建楠路４７號,(07)3522161,274,946,2020/03/01 15:48:09
5902040229,進昇藥局,高雄市楠梓區德賢路２０２號,(07)3652334,0,688,2020/03/01 15:48:09
5902040238,筆秀藥局,高雄市楠梓區青埔街１５２號,(07)3622412,68,480,2020/03/01 15:48:09
5902040274,千惠藥局,高雄市楠梓區和光街１８１號,(07)3631268,496,1110,2020/03/01 15:48:09
5902040498,順明藥局,高雄市楠梓區和光街６５號,(07)3615574,0,1600,2020/03/01 15:48:09
5902040532,聯亞藥局,高雄市揇梓區軍校路７１０號,(07)3638387,256,1408,2020/03/01 15:48:09
5902041226,正人藥師藥局,高雄市楠梓區和昌里軍校路６７２號,(07)3652942,0,1450,2020/03/01 15:48:09
5902042269,常禾藥局,高雄市楠梓區常德路３３３號一樓,(07)3537431,0,825,2020/03/01 15:48:09
5902042376,佶辰藥局,高雄市楠梓區德民路６４１號１Ｆ,(07)3662802,0,898,2020/03/01 15:48:09
5902042447,建佑藥局,高雄市楠梓區右昌街１９１號,(07)3626893,0,4,2020/03/01 15:48:09
5902042474,誠群藥局,高雄市楠梓區樂群路１８２號１樓,(07)3661733,0,432,2020/03/01 15:48:09
5902042492,合德中西藥師藥局,高雄市楠梓區楠梓路４８６號,(07)3581291,70,523,2020/03/01 15:48:09
